tweetDate,twitterId,handle,text,profileUrl,name,tweetLink,timestamp,query
Thu Jun 24 15:46:30 +0000 2021,25185308,sergio_fajardo,Hoy desde Bucaramanga estamos con la @CoaliEsperanza para contarles que no seguimos a un líder ungido que nos va a llevar a la tierra prometida. Estamos trabajando y construyendo entre diferentes para encontrar una salida a los problemas de Colombia. https://t.co/1GsuVaMRoU,https://twitter.com/sergio_fajardo,Sergio Fajardo,https://twitter.com/sergio_fajardo/status/1408089156094418944,2021-09-06T20:03:09.573Z,https://twitter.com/search?q=from%3Asergio_fajardo%20since%3A2021-04-01%20until%3A2021-06-30&src=typed_query&f=live
Tue Jun 29 02:17:50 +0000 2021,25185308,sergio_fajardo,https://t.co/Jeaor2XaZ9,https://twitter.com/sergio_fajardo,Sergio Fajardo,https://twitter.com/sergio_fajardo/status/1409697588429737989,2021-09-06T20:03:09.573Z,https://twitter.com/search?q=from%3Asergio_fajardo%20since%3A2021-04-01%20until%3A2021-06-30&src=typed_query&f=live
Sun Jun 27 09:45:48 +0000 2021,49849732,petrogustavo,"Hay que tener absoluta falta de comprensión de lectura y una ignorancia de la historia reciente del pais, para no darse cuenta que no me refiero a Mockus.

Los candidatos únicos surgieron de la mano del paramilitarismo que mataba o amenazaba a sus posibles contrincantes.",https://twitter.com/petrogustavo,Gustavo Petro,https://twitter.com/petrogustavo/status/1409085548552200193,2021-09-06T20:03:09.573Z,https://twitter.com/search?q=from%3Asergio_fajardo%20since%3A2021-04-01%20until%3A2021-06-30&src=typed_query&f=live
Thu Jun 24 14:29:31 +0000 2021,25185308,sergio_fajardo,"Emocionante ver que figuras de la talla de José Antonio Ocampo y los demás firmantes apoyan a la @CoaliEsperanza; es un indicador importante de que vamos por buen camino. Coincido en que #PopulismosSonAbismos, yo también #MeLaJuegoPorLaEsperanza",https://twitter.com/sergio_fajardo,Sergio Fajardo,https://twitter.com/sergio_fajardo/status/1408069781790478337,2021-09-06T20:03:09.573Z,https://twitter.com/search?q=from%3Asergio_fajardo%20since%3A2021-04-01%20until%3A2021-06-30&src=typed_query&f=live
Mon Jun 28 23:00:52 +0000 2021,25185308,sergio_fajardo,Me saludan al autor. https://t.co/4w6ewLyvp7,https://twitter.com/sergio_fajardo,Sergio Fajardo,https://twitter.com/sergio_fajardo/status/1409648018958127111,2021-09-06T20:03:09.573Z,https://twitter.com/search?q=from%3Asergio_fajardo%20since%3A2021-04-01%20until%3A2021-06-30&src=typed_query&f=live
Thu Jun 24 13:25:40 +0000 2021,875534663967703040,JoseA_Ocampo,"En esta Declaración, un conjunto de ex-ministros, intelectuales, líderes feministas, sociales y juveniles, y personalidades de la cultura y el periodismo, expresamos nuestro apoyo a la coalición del futuro, la Coalición de la Esperanza! Léela y fírmala. https://t.co/YiRjK8NBMz",https://twitter.com/JoseA_Ocampo,Jose Antonio Ocampo,https://twitter.com/JoseA_Ocampo/status/1408053712174657539,2021-09-06T20:03:09.573Z,https://twitter.com/search?q=from%3Asergio_fajardo%20since%3A2021-04-01%20until%3A2021-06-30&src=typed_query&f=live
Mon Jun 28 13:56:04 +0000 2021,704657030762663936,compromisociu,"Por décadas, la comunidad LGBTIQ+ ha sido símbolo de persistencia en Colombia. Hemos avanzado en el camino por la igualdad, pero aún faltan pasos por dar. En el día del #Orgullo , recordemos lo que nos ha llevado a seguir en esta lucha 🏳️‍🌈🏳️‍⚧️ https://t.co/4ZWvXgVX6L",https://twitter.com/compromisociu,Compromiso Ciudadano,https://twitter.com/compromisociu/status/1409510914676740099,2021-09-06T20:03:09.573Z,https://twitter.com/search?q=from%3Asergio_fajardo%20since%3A2021-04-01%20until%3A2021-06-30&src=typed_query&f=live
Fri Jun 25 23:59:07 +0000 2021,25185308,sergio_fajardo,El atentado contra el presidente Duque es la expresión máxima de la barbarie que busca la guerra total en Colombia. Solidaridad con el Presidente y sus ministros. Cuidemos a Colombia.,https://twitter.com/sergio_fajardo,Sergio Fajardo,https://twitter.com/sergio_fajardo/status/1408575515909296132,2021-09-06T20:03:09.573Z,https://twitter.com/search?q=from%3Asergio_fajardo%20since%3A2021-04-01%20until%3A2021-06-30&src=typed_query&f=live
Sat Jun 26 02:32:14 +0000 2021,622082899,BluRadioCo,"Motociclista murió tras chocar con cuerda atravesada en bloqueos en Portal Américas, en Bogotá #VocesySonidos https://t.co/uE1Sh2A8dR",https://twitter.com/BluRadioCo,BluRadio Colombia,https://twitter.com/BluRadioCo/status/1408614048673923077,2021-09-06T20:03:09.573Z,https://twitter.com/search?q=from%3Asergio_fajardo%20since%3A2021-04-01%20until%3A2021-06-30&src=typed_query&f=live
Sat Jun 26 15:00:12 +0000 2021,25185308,sergio_fajardo,La violencia es el fracaso. Cualquier lucha se desvanece. Una cuerda atravesada en una calle en Bogotá se convirtió en una persona muerta. Mis condolencias a la familia de Cristián Camilo. Imaginen el dolor que hoy tienen. No hay derecho.,https://twitter.com/sergio_fajardo,Sergio Fajardo,https://twitter.com/sergio_fajardo/status/1408802278283386880,2021-09-06T20:03:09.573Z,https://twitter.com/search?q=from%3Asergio_fajardo%20since%3A2021-04-01%20until%3A2021-06-30&src=typed_query&f=live
Mon Jun 28 13:18:12 +0000 2021,25185308,sergio_fajardo,"Dueño del conocimiento, poseedor de la verdad, rey de la justicia y vocero de la sabiduría. Petro, iluminado, libre pensador*",https://twitter.com/sergio_fajardo,Sergio Fajardo,https://twitter.com/sergio_fajardo/status/1409501385331183618,2021-09-06T20:03:09.573Z,https://twitter.com/search?q=from%3Asergio_fajardo%20since%3A2021-04-01%20until%3A2021-06-30&src=typed_query&f=live
Thu Jun 24 23:07:53 +0000 2021,25185308,sergio_fajardo,"Vamos terminando una jornada clave en Bucaramanga. Hemos escuchado a comunidades y jóvenes sobre empleo, medio ambiente y educación. Seguimos en la tarea de mostrarle al país que somos capaces de encontrarnos para construir. https://t.co/TdEfMUVrCo",https://twitter.com/sergio_fajardo,Sergio Fajardo,https://twitter.com/sergio_fajardo/status/1408200233465548804,2021-09-06T20:03:09.573Z,https://twitter.com/search?q=from%3Asergio_fajardo%20since%3A2021-04-01%20until%3A2021-06-30&src=typed_query&f=live
Fri Jun 25 17:30:44 +0000 2021,25185308,sergio_fajardo,"La Coalición de la Esperanza es un ejercicio inédito en el país. Es el ejemplo, en este momento preciso, de lo que necesitamos hacer los colombianos. Construir, escuchar, reconocer al que es diferente a partir de unos principios éticos.  https://t.co/vhq7oTiixT",https://twitter.com/sergio_fajardo,Sergio Fajardo,https://twitter.com/sergio_fajardo/status/1408477776164888579,2021-09-06T20:03:09.573Z,https://twitter.com/search?q=from%3Asergio_fajardo%20since%3A2021-04-01%20until%3A2021-06-30&src=typed_query&f=live
Thu Jun 24 13:12:01 +0000 2021,25185308,sergio_fajardo,"Los embargos no cambian gobiernos, van directamente contra las personas: aumentan sus sufrimientos. Históricamente el país  rechazaba el embargo a Cuba. Hoy somos 1 de 3 países (contra 190) que avalan con su abstención una medida anacrónica. Se equivoca el gobierno de nuevo.",https://twitter.com/sergio_fajardo,Sergio Fajardo,https://twitter.com/sergio_fajardo/status/1408050277635215360,2021-09-06T20:03:09.573Z,https://twitter.com/search?q=from%3Asergio_fajardo%20since%3A2021-04-01%20until%3A2021-06-30&src=typed_query&f=live
Sun Jun 27 21:28:49 +0000 2021,25185308,sergio_fajardo,"Dueño del conocimiento, poseedor de la verdad, rey de la justicia y vocero de la sabiduría. Petro, iluminado.",https://twitter.com/sergio_fajardo,Sergio Fajardo,https://twitter.com/sergio_fajardo/status/1409262467889471488,2021-09-06T20:03:09.573Z,https://twitter.com/search?q=from%3Asergio_fajardo%20since%3A2021-04-01%20until%3A2021-06-30&src=typed_query&f=live
Tue Jun 29 01:31:30 +0000 2021,25185308,sergio_fajardo,"Dialogar. Escuchar. Participar. Mucho hablamos de eso pero poco se ve. Les invito el miércoles a las 6pm a que discutamos el ejercicio en torno a nuestro plan de empleo juvenil, que recibió más de 1000 comentarios de todo el país. https://t.co/FDkbVxRUse https://t.co/qHq3iAdlOT",https://twitter.com/sergio_fajardo,Sergio Fajardo,https://twitter.com/sergio_fajardo/status/1409685927044161542,2021-09-06T20:03:09.573Z,https://twitter.com/search?q=from%3Asergio_fajardo%20since%3A2021-04-01%20until%3A2021-06-30&src=typed_query&f=live
Mon Jun 28 12:27:36 +0000 2021,49849732,petrogustavo,"Nadie que sea libre pensador se cree dueño del conocimiento. 

Yo soy librepensador, Sergio, pero no bobo. Detecto las campañas de desprestigio y el intento de parte de ustedes de hacernos parecer extremistas cuando, ni más ni menos, defendemos y luchamos por la democracia.",https://twitter.com/petrogustavo,Gustavo Petro,https://twitter.com/petrogustavo/status/1409488650983837703,2021-09-06T20:03:09.573Z,https://twitter.com/search?q=from%3Asergio_fajardo%20since%3A2021-04-01%20until%3A2021-06-30&src=typed_query&f=live
Mon Jun 28 21:01:27 +0000 2021,25185308,sergio_fajardo,"Hoy, día del #Orgullo , sobran motivos para reflexionar. La expectativa de vida de personas trans sigue siendo preocupante y no existe hoy una política clara frente a la discriminación contra la comunidad LGBTIQ+. Falta mucho por avanzar por la igualdad todavía.",https://twitter.com/sergio_fajardo,Sergio Fajardo,https://twitter.com/sergio_fajardo/status/1409617965952258049,2021-09-06T20:03:09.573Z,https://twitter.com/search?q=from%3Asergio_fajardo%20since%3A2021-04-01%20until%3A2021-06-30&src=typed_query&f=live
Thu Jun 24 20:45:31 +0000 2021,25185308,sergio_fajardo,"Destaco la valentía de quienes firmaron la carta de apoyo a la Coalición de la Esperanza. No podemos caer en el juego de las agresiones constantes, tenemos que atrevernos a hablar. Bienvenidos a firmar también la carta: https://t.co/tL6FYaVl8A https://t.co/NtcnrG6IJn",https://twitter.com/sergio_fajardo,Sergio Fajardo,https://twitter.com/sergio_fajardo/status/1408164405066485762,2021-09-06T20:03:09.573Z,https://twitter.com/search?q=from%3Asergio_fajardo%20since%3A2021-04-01%20until%3A2021-06-30&src=typed_query&f=live
Fri Jun 25 02:28:43 +0000 2021,25185308,sergio_fajardo,"""Yo esperaba que se quitaran las máscaras"" dijo Ingrid Betancur sobre los ex-guerrileros de las FARC que comparecieron ante la JEP en frente de las personas que hablan secuestrado. No se las quitaron: nadie puede dar lo que no tiene. 
https://t.co/EpAb5nkWiJ",https://twitter.com/sergio_fajardo,Sergio Fajardo,https://twitter.com/sergio_fajardo/status/1408250775298625539,2021-09-06T20:03:09.573Z,https://twitter.com/search?q=from%3Asergio_fajardo%20since%3A2021-04-01%20until%3A2021-06-30&src=typed_query&f=live
Mon Jun 28 12:39:47 +0000 2021,25185308,sergio_fajardo,"Les hago una invitación a dejar de lado la misoginia, la homofobia, la masculinidad frágil. Bienvenidas las críticas y hasta las burlas, pero con algo de sustento, con argumentos y con sentido. #ContraElFacilismo",https://twitter.com/sergio_fajardo,Sergio Fajardo,https://twitter.com/sergio_fajardo/status/1409491718467166215,2021-09-06T20:03:09.573Z,https://twitter.com/search?q=from%3Asergio_fajardo%20since%3A2021-04-01%20until%3A2021-06-30&src=typed_query&f=live
Thu Jun 24 23:09:07 +0000 2021,25185308,sergio_fajardo,"Bucaramanga, siempre ciudad bonita. https://t.co/8qg1I0z7Di",https://twitter.com/sergio_fajardo,Sergio Fajardo,https://twitter.com/sergio_fajardo/status/1408200542954926091,2021-09-06T20:03:09.573Z,https://twitter.com/search?q=from%3Asergio_fajardo%20since%3A2021-04-01%20until%3A2021-06-30&src=typed_query&f=live
Thu Jun 24 14:29:33 +0000 2021,25185308,sergio_fajardo,Acá quienes han firmado la carta: https://t.co/3lYB8fBL3V,https://twitter.com/sergio_fajardo,Sergio Fajardo,https://twitter.com/sergio_fajardo/status/1408069789117943821,2021-09-06T20:03:09.573Z,https://twitter.com/search?q=from%3Asergio_fajardo%20since%3A2021-04-01%20until%3A2021-06-30&src=typed_query&f=live
Mon Jun 28 00:50:39 +0000 2021,939908874357870592,DonIzquierdo_,¿Ustedes ya se dejaron conquistar? https://t.co/oXwhkCKNxW,https://twitter.com/DonIzquierdo_,David Rozo,https://twitter.com/DonIzquierdo_/status/1409313261535875076,2021-09-06T20:03:09.573Z,https://twitter.com/search?q=from%3Asergio_fajardo%20since%3A2021-04-01%20until%3A2021-06-30&src=typed_query&f=live
Tue Jun 29 23:59:53 +0000 2021,25185308,sergio_fajardo,"Bueno, mañana a las 6:00 p.m. discutiremos la propuesta de empleo juvenil que sometimos a revisión y aportes de la gente. Me gustaría que se conectaran, en especial las personas que se tomaron el tiempo de leer y proponer. Les dejo el link https://t.co/acsbLzjq4m https://t.co/ruo5JGtXP9",https://twitter.com/sergio_fajardo,Sergio Fajardo,https://twitter.com/sergio_fajardo/status/1410025258309062658,2021-09-06T20:03:09.573Z,https://twitter.com/search?q=from%3Asergio_fajardo%20since%3A2021-04-01%20until%3A2021-06-30&src=typed_query&f=live
Sun Jun 27 21:42:00 +0000 2021,25185308,sergio_fajardo,"Voten en blanco, voten por nosotros, voten por Petro o por el que quieran. El voto es de cada individuo y los políticos sólo estamos llamados a respetarlo. El voto es absolutamente libre, cualquier intento de limitarlo no es democracia. Feliz domingo.",https://twitter.com/sergio_fajardo,Sergio Fajardo,https://twitter.com/sergio_fajardo/status/1409265785915297796,2021-09-06T20:03:09.573Z,https://twitter.com/search?q=from%3Asergio_fajardo%20since%3A2021-04-01%20until%3A2021-06-30&src=typed_query&f=live
Wed Jun 16 02:50:41 +0000 2021,25185308,sergio_fajardo,Estaremos estos 5 días recogiendo aportes para nutrir nuestro borrador de empleo juvenil. Dejo el link nuevamente: https://t.co/acsbLzjq4m,https://twitter.com/sergio_fajardo,Sergio Fajardo,https://twitter.com/sergio_fajardo/status/1404994811837431813,2021-09-06T20:03:09.573Z,https://twitter.com/search?q=from%3Asergio_fajardo%20since%3A2021-04-01%20until%3A2021-06-30&src=typed_query&f=live
Thu Jun 17 19:00:06 +0000 2021,25185308,sergio_fajardo,Más de 3.800 visitas y 520 comentarios ha tenido el borrador de nuestra propuesta de empleo juvenil. Muchas gracias a quienes se han tomado el tiempo de escribir sus opiniones. Aún quedan tres días para recoger sus aportes e ir #MásAlláDeUnTrino https://t.co/acsbLzjq4m,https://twitter.com/sergio_fajardo,Sergio Fajardo,https://twitter.com/sergio_fajardo/status/1405601161588219908,2021-09-06T20:03:09.573Z,https://twitter.com/search?q=from%3Asergio_fajardo%20since%3A2021-04-01%20until%3A2021-06-30&src=typed_query&f=live
Tue Jun 22 16:29:43 +0000 2021,334921284,fdbedout,"Desde el Petrismo  responsabilizan a los que “votaron en blanco” del triunfo “del que dijo Uribe”, y para conquistar ese voto llevan tres años insultando a los que “votaron en blanco”. Una estrategia electoral bastante particular por decirlo de alguna manera.",https://twitter.com/fdbedout,Félix de Bedout,https://twitter.com/fdbedout/status/1407375255493136387,2021-09-06T20:03:09.573Z,https://twitter.com/search?q=from%3Asergio_fajardo%20since%3A2021-04-01%20until%3A2021-06-30&src=typed_query&f=live
Wed Jun 23 18:19:32 +0000 2021,25185308,sergio_fajardo,"Para dejar atrás la violencia que por años nos ha dividido, necesitamos escucharnos y reconocernos. El esfuerzo que hace en ese sentido la @ComisionVerdadC es admirable. Imposible no emocionarse hoy en #VerdadesQueLiberen. El Perdón es el único camino que tenemos.",https://twitter.com/sergio_fajardo,Sergio Fajardo,https://twitter.com/sergio_fajardo/status/1407765281947144194,2021-09-06T20:03:09.573Z,https://twitter.com/search?q=from%3Asergio_fajardo%20since%3A2021-04-01%20until%3A2021-06-30&src=typed_query&f=live
Thu Jun 17 12:29:55 +0000 2021,80403388,lapatriacom,#AEstaHora Entrevista en @LaPatriaRadio con los miembros de la Coalición de la Esperanza @JERobledo @sergio_fajardo @CristoBustos @juanmanuelgalan  que visitan hoy #Manizales https://t.co/40gcUVvsj3,https://twitter.com/lapatriacom,Periódico LA PATRIA,https://twitter.com/lapatriacom/status/1405502970356248577,2021-09-06T20:03:09.573Z,https://twitter.com/search?q=from%3Asergio_fajardo%20since%3A2021-04-01%20until%3A2021-06-30&src=typed_query&f=live
Wed Jun 16 11:01:05 +0000 2021,25185308,sergio_fajardo,"Hoy y mañana estaremos en el eje cafetero con la coalición de la esperanza. Armenia, Pereira y Manizales. Buen augurio: bonito amanecer en Bogotá. https://t.co/kqxEXULvj3",https://twitter.com/sergio_fajardo,Sergio Fajardo,https://twitter.com/sergio_fajardo/status/1405118227252977667,2021-09-06T20:03:09.573Z,https://twitter.com/search?q=from%3Asergio_fajardo%20since%3A2021-04-01%20until%3A2021-06-30&src=typed_query&f=live
Tue Jun 22 00:26:46 +0000 2021,25185308,sergio_fajardo,Muchas gracias por sus aportes a nuestro plan de empleo juvenil. Recibimos más de 1.000 comentarios que nos ayudarán a construir una propuesta que sirva como hoja de ruta para el país y los territorios. Consolidaremos comentarios y anunciaremos la fecha del Zoom para discutirlos.,https://twitter.com/sergio_fajardo,Sergio Fajardo,https://twitter.com/sergio_fajardo/status/1407132922914672640,2021-09-06T20:03:09.573Z,https://twitter.com/search?q=from%3Asergio_fajardo%20since%3A2021-04-01%20until%3A2021-06-30&src=typed_query&f=live
Thu Jun 17 12:35:03 +0000 2021,25185308,sergio_fajardo,En @LaPatriaRadio en vivo,https://twitter.com/sergio_fajardo,Sergio Fajardo,https://twitter.com/sergio_fajardo/status/1405504260574416898,2021-09-06T20:03:09.573Z,https://twitter.com/search?q=from%3Asergio_fajardo%20since%3A2021-04-01%20until%3A2021-06-30&src=typed_query&f=live
Wed Jun 16 00:16:36 +0000 2021,25185308,sergio_fajardo,"En este link https://t.co/acsbLzjq4m pueden leer, complementar y corregir el borrador de nuestro plan de empleo para jóvenes e ir #MásAlláDeUnTrino. Ni el narcotráfico, ni la delincuencia, ni la falta de oportunidades pueden ser la respuesta a las necesidades de los jóvenes. https://t.co/1dWVIm1DHQ",https://twitter.com/sergio_fajardo,Sergio Fajardo,https://twitter.com/sergio_fajardo/status/1404956034804879362,2021-09-06T20:03:09.573Z,https://twitter.com/search?q=from%3Asergio_fajardo%20since%3A2021-04-01%20until%3A2021-06-30&src=typed_query&f=live
Thu Jun 17 13:40:23 +0000 2021,25185308,sergio_fajardo,"Una de nuestras metas es que ser educador sea reconocido como una actividad extraordinaria en nuestra sociedad. Hoy en Manizales, ciudad universitaria, recuerdo esta conversación con Carolina y Santiago sobre su vocación. https://t.co/ozGWiEN08T",https://twitter.com/sergio_fajardo,Sergio Fajardo,https://twitter.com/sergio_fajardo/status/1405520703013543937,2021-09-06T20:03:09.573Z,https://twitter.com/search?q=from%3Asergio_fajardo%20since%3A2021-04-01%20until%3A2021-06-30&src=typed_query&f=live
Thu Jun 17 17:46:02 +0000 2021,25185308,sergio_fajardo,"En Manizales esta mañana estuvimos con la @CoaliEsperanza escuchando los justos reclamos de jóvenes, líderes y lideresas de comunidades que quieren un mejor país. El diálogo es la salida, siempre. https://t.co/P5yR89DTfo",https://twitter.com/sergio_fajardo,Sergio Fajardo,https://twitter.com/sergio_fajardo/status/1405582523543982087,2021-09-06T20:03:09.573Z,https://twitter.com/search?q=from%3Asergio_fajardo%20since%3A2021-04-01%20until%3A2021-06-30&src=typed_query&f=live
Fri Jun 18 21:32:43 +0000 2021,25185308,sergio_fajardo,El gobierno Duque incumple su palabra. Se había comprometido a promover el proyecto de ley de especialidad agraria y no lo hizo. Era la única iniciativa presentada por el gobierno para implementar el Acuerdo de Paz. Le fallan a la paz y le fallan al país.,https://twitter.com/sergio_fajardo,Sergio Fajardo,https://twitter.com/sergio_fajardo/status/1406001958956240899,2021-09-06T20:03:09.573Z,https://twitter.com/search?q=from%3Asergio_fajardo%20since%3A2021-04-01%20until%3A2021-06-30&src=typed_query&f=live
Tue Jun 22 18:42:41 +0000 2021,25185308,sergio_fajardo,"La semana pasada no pude venir al Quindío, hoy le madrugamos a Salento y Armenia para conversar con jóvenes y líderes y lideresas sociales para escuchar sus reclamos y opiniones sobre el país. El diálogo y el reconocimiento son la clave. Sin miedo, sin rabia. https://t.co/ughBIozvFr",https://twitter.com/sergio_fajardo,Sergio Fajardo,https://twitter.com/sergio_fajardo/status/1407408718464094219,2021-09-06T20:03:09.573Z,https://twitter.com/search?q=from%3Asergio_fajardo%20since%3A2021-04-01%20until%3A2021-06-30&src=typed_query&f=live
Thu Jun 17 02:51:23 +0000 2021,25185308,sergio_fajardo,"La Coalición de la Esperanza: somos la primera opción
https://t.co/aQfuS2TW7q",https://twitter.com/sergio_fajardo,Sergio Fajardo,https://twitter.com/sergio_fajardo/status/1405357375658381315,2021-09-06T20:03:09.573Z,https://twitter.com/search?q=from%3Asergio_fajardo%20since%3A2021-04-01%20until%3A2021-06-30&src=typed_query&f=live
Tue Jun 22 20:42:00 +0000 2021,25185308,sergio_fajardo,Habría podido cerrar con broche de oro con un Ministro sin cuestionamientos éticos y respaldado por la comunidad científica. Lástima.,https://twitter.com/sergio_fajardo,Sergio Fajardo,https://twitter.com/sergio_fajardo/status/1407438744332943361,2021-09-06T20:03:09.573Z,https://twitter.com/search?q=from%3Asergio_fajardo%20since%3A2021-04-01%20until%3A2021-06-30&src=typed_query&f=live
Tue Jun 22 18:14:51 +0000 2021,77653794,IvanDuque,"Sabemos que el @MincienciasCo sacará adelante los retos y no solo seremos el Gobierno que creó el Ministerio sino el que dejó la mayor inversión público-privada en tecnología, la red activa universitaria, empresarial y científica para que estemos a la vanguardia en investigación. https://t.co/N8n52z20gr",https://twitter.com/IvanDuque,Iván Duque 🇨🇴,https://twitter.com/IvanDuque/status/1407401712273534980,2021-09-06T20:03:09.573Z,https://twitter.com/search?q=from%3Asergio_fajardo%20since%3A2021-04-01%20until%3A2021-06-30&src=typed_query&f=live
Mon Jun 21 00:00:37 +0000 2021,25185308,sergio_fajardo,Feliz día del padre 😎 https://t.co/SKVEkpOyn3,https://twitter.com/sergio_fajardo,Sergio Fajardo,https://twitter.com/sergio_fajardo/status/1406763952550432768,2021-09-06T20:03:09.573Z,https://twitter.com/search?q=from%3Asergio_fajardo%20since%3A2021-04-01%20until%3A2021-06-30&src=typed_query&f=live
Wed Jun 23 00:36:23 +0000 2021,25185308,sergio_fajardo,"Quindío representa bien la tragedia de la clase política tradicional. Con tantos atributos naturales, ha sido capturado por un par de grupos políticos que lo han convertido en fortín de unos pocos, ante los cuales todo el departamento se debe arrodillar. Esto tiene que cambiar. https://t.co/k1Lopz2VSR",https://twitter.com/sergio_fajardo,Sergio Fajardo,https://twitter.com/sergio_fajardo/status/1407497731757772803,2021-09-06T20:03:09.573Z,https://twitter.com/search?q=from%3Asergio_fajardo%20since%3A2021-04-01%20until%3A2021-06-30&src=typed_query&f=live
Wed Jun 16 17:28:51 +0000 2021,25185308,sergio_fajardo,Seguimos recogiendo aportes. Nos han escrito unos muy valiosos. La discusión estará nutrida e irá #MásAlláDeUnTrino. Volvemos a dejar el link con el borrador de empleo juvenil. Gracias a los que están colaborando https://t.co/acsbLzjq4m https://t.co/egPxjUZsj5,https://twitter.com/sergio_fajardo,Sergio Fajardo,https://twitter.com/sergio_fajardo/status/1405215812152086533,2021-09-06T20:03:09.573Z,https://twitter.com/search?q=from%3Asergio_fajardo%20since%3A2021-04-01%20until%3A2021-06-30&src=typed_query&f=live
Fri Jun 18 14:50:45 +0000 2021,25185308,sergio_fajardo,"Siempre razonable. 
Ministerio de Ciencia https://t.co/CTOqqUQVFP",https://twitter.com/sergio_fajardo,Sergio Fajardo,https://twitter.com/sergio_fajardo/status/1405900799310508037,2021-09-06T20:03:09.573Z,https://twitter.com/search?q=from%3Asergio_fajardo%20since%3A2021-04-01%20until%3A2021-06-30&src=typed_query&f=live
Wed Jun 23 01:38:19 +0000 2021,25185308,sergio_fajardo,Doy fe de ello.,https://twitter.com/sergio_fajardo,Sergio Fajardo,https://twitter.com/sergio_fajardo/status/1407513314620542979,2021-09-06T20:03:09.573Z,https://twitter.com/search?q=from%3Asergio_fajardo%20since%3A2021-04-01%20until%3A2021-06-30&src=typed_query&f=live
Sat Jun 19 18:10:04 +0000 2021,25185308,sergio_fajardo,"¿Que por qué protestan los jóvenes? Porque el gobierno no cumple sus promesas. En noviembre de 2019, tras primeras manifestaciones, Duque aceptó firmar el Acuerdo de Escazú. Hoy, en complicidad con mayorías del Congreso, lo están hundiendo. Cumplan la palabra: ratifiquen Escazú.",https://twitter.com/sergio_fajardo,Sergio Fajardo,https://twitter.com/sergio_fajardo/status/1406313346069106692,2021-09-06T20:03:09.573Z,https://twitter.com/search?q=from%3Asergio_fajardo%20since%3A2021-04-01%20until%3A2021-06-30&src=typed_query&f=live
Mon Jun 21 18:21:14 +0000 2021,25185308,sergio_fajardo,"Toda mi solidaridad con la familia de Santiago Ochoa. ¿A qué nivel de barbarie vamos a llegar? El país entero debería estar hablando hoy de esto y exigiendo respuestas contundentes. No es ni siquiera un retroceso a los 90s, es sevicia; la pérdida absoluta de humanidad.",https://twitter.com/sergio_fajardo,Sergio Fajardo,https://twitter.com/sergio_fajardo/status/1407040933451948034,2021-09-06T20:03:09.573Z,https://twitter.com/search?q=from%3Asergio_fajardo%20since%3A2021-04-01%20until%3A2021-06-30&src=typed_query&f=live
Fri Jun 18 21:32:44 +0000 2021,25185308,sergio_fajardo,"Mientras insistamos en esa nefasta idea de que quien llega a gobernar debe desmontar los logros de su predecesor para poder brillar, estaremos condenados a ser un país que no avanza en el tiempo: un país estancado en la violencia y la desigualdad.",https://twitter.com/sergio_fajardo,Sergio Fajardo,https://twitter.com/sergio_fajardo/status/1406001960319397889,2021-09-06T20:03:09.573Z,https://twitter.com/search?q=from%3Asergio_fajardo%20since%3A2021-04-01%20until%3A2021-06-30&src=typed_query&f=live
