tweetDate,twitterId,handle,text,profileUrl,name,tweetLink,timestamp,query
Tue May 04 21:01:06 +0000 2021,44740326,lunadavid,"Lo que está sucediendo en el país 🇨🇴 no se puede reducir a una batalla entre el gobierno y la oposición. 

En este momento no necesitamos más odio: necesitamos diálogo, acuerdos, una agenda pública para escuchar las preocupaciones de unos y otros, es momento de reconciliarnos.",https://twitter.com/lunadavid,David Luna,https://twitter.com/lunadavid/status/1389686545033142273,2021-09-06T18:43:50.061Z,https://twitter.com/search?q=from%3Alunadavid%20since%3A2021-04-01%20until%3A2021-06-30&src=typed_query&f=live
Wed May 12 13:22:12 +0000 2021,44740326,lunadavid,@jnietoblanco Fuerza!!!!!,https://twitter.com/lunadavid,David Luna,https://twitter.com/lunadavid/status/1392470163237261315,2021-09-06T18:43:50.061Z,https://twitter.com/search?q=from%3Alunadavid%20since%3A2021-04-01%20until%3A2021-06-30&src=typed_query&f=live
Thu May 13 01:26:09 +0000 2021,44740326,lunadavid,"Todos somos colombianos 🇨🇴 , todos debemos aportar a la reconciliación del país a través del diálogo, con humildad y respeto por el otro. Gran enseñanza la de este video #ColombiaMadreDeTodos https://t.co/L50mZkOUj2",https://twitter.com/lunadavid,David Luna,https://twitter.com/lunadavid/status/1392652352423964675,2021-09-06T18:43:50.061Z,https://twitter.com/search?q=from%3Alunadavid%20since%3A2021-04-01%20until%3A2021-06-30&src=typed_query&f=live
Tue May 04 16:13:52 +0000 2021,44740326,lunadavid,"Colombia necesita construir un consenso para lograr reconciliarse. Es fundamental dialogar entre quienes pensamos distinto, respetando y construyendo sobre la divergencia. Nada sacamos si los convocados son quienes piensan igual. Los invito a 🎧 👉🏼 
https://t.co/pyZtGttMGp https://t.co/ChXYN2P3pl",https://twitter.com/lunadavid,David Luna,https://twitter.com/lunadavid/status/1389614261450821643,2021-09-06T18:43:50.061Z,https://twitter.com/search?q=from%3Alunadavid%20since%3A2021-04-01%20until%3A2021-06-30&src=typed_query&f=live
Wed May 12 14:59:11 +0000 2021,44740326,lunadavid,"Yo aporto respetando la diferencia e incentivando la inclusión a través de @alcentro_co. 
Esta incubadora de ideas y liderazgos sociales plantea soluciones a los problemas del país 🇨🇴,con base en la evidencia y no en el populismo.
@alcentro_co construye sobre lo construido.",https://twitter.com/lunadavid,David Luna,https://twitter.com/lunadavid/status/1392494572291469314,2021-09-06T18:43:50.061Z,https://twitter.com/search?q=from%3Alunadavid%20since%3A2021-04-01%20until%3A2021-06-30&src=typed_query&f=live
Thu May 20 12:01:56 +0000 2021,44740326,lunadavid,"#UnaBuenaNoticia @TikTokLatAM, la plataforma lider a nivel mundial de videos cortos, se une hoy a la @alianzain1 para seguir aportando al ecosistema y la alfabetización digital de Colombia 🇨🇴 .   👏🏻 👏🏻👉🏼 https://t.co/cu2oXhmgRr. https://t.co/azbPDrYecD",https://twitter.com/lunadavid,David Luna,https://twitter.com/lunadavid/status/1395349067320991744,2021-09-06T18:43:50.061Z,https://twitter.com/search?q=from%3Alunadavid%20since%3A2021-04-01%20until%3A2021-06-30&src=typed_query&f=live
Sat May 08 22:02:04 +0000 2021,44740326,lunadavid,"Presidente @IvanDuque, su presencia en Cali es indispensable e INAPLAZABLE. Los caleños necesitan el respaldo de los colombianos, empezando por la figura presidencial. Es preciso proteger el derecho a la protesta, garantizar los derechos humanos y enfrentar el crimen organizado.",https://twitter.com/lunadavid,David Luna,https://twitter.com/lunadavid/status/1391151440752783369,2021-09-06T18:43:50.061Z,https://twitter.com/search?q=from%3Alunadavid%20since%3A2021-04-01%20until%3A2021-06-30&src=typed_query&f=live
Thu May 06 18:16:08 +0000 2021,44740326,lunadavid,"#LucasVilla siempre será un ejemplo a seguir. Expresó sus desacuerdos pacíficamente, en calma e incluso bailando. Su muerte es dolorosa, demuestra lo perjudicial que es el odio. La vida es sagrada.",https://twitter.com/lunadavid,David Luna,https://twitter.com/lunadavid/status/1390369805417463812,2021-09-06T18:43:50.061Z,https://twitter.com/search?q=from%3Alunadavid%20since%3A2021-04-01%20until%3A2021-06-30&src=typed_query&f=live
Wed May 05 03:33:16 +0000 2021,44740326,lunadavid,"Ninguna vida humana vale mas que otra, son inconcebibles e inaceptables estos criminales actos. No más violencia, no más odio.  Policías y manifestantes son seres humanos, la vida es sagrada.",https://twitter.com/lunadavid,David Luna,https://twitter.com/lunadavid/status/1389785240282017799,2021-09-06T18:43:50.061Z,https://twitter.com/search?q=from%3Alunadavid%20since%3A2021-04-01%20until%3A2021-06-30&src=typed_query&f=live
Wed May 12 03:37:18 +0000 2021,44740326,lunadavid,"@jrodriguezk @ProBogotaRegion Eres un referente para miles de niñas y mujeres que quieren y pueden crecer en tecnología, emprendimiento e innovación. Que orgullo, felicitaciones!!!",https://twitter.com/lunadavid,David Luna,https://twitter.com/lunadavid/status/1392322969620434945,2021-09-06T18:43:50.061Z,https://twitter.com/search?q=from%3Alunadavid%20since%3A2021-04-01%20until%3A2021-06-30&src=typed_query&f=live
Tue May 11 14:16:42 +0000 2021,44740326,lunadavid,Por la paz y la reconciliación de Colombia 🇨🇴 : #YoPido 👇🏼👇🏼 https://t.co/WUxmpG8aK3,https://twitter.com/lunadavid,David Luna,https://twitter.com/lunadavid/status/1392121490670247944,2021-09-06T18:43:50.061Z,https://twitter.com/search?q=from%3Alunadavid%20since%3A2021-04-01%20until%3A2021-06-30&src=typed_query&f=live
Mon May 17 02:56:55 +0000 2021,3222731,latercera,"Presidente Piñera: ""La ciudadanía nos ha enviado un claro y fuerte mensaje al gobierno y también a todas las fuerzas políticas tradicionales. No estamos sintonizando adecuadamente con las demandas y anhelos de la ciudadanía"" https://t.co/uevyl7Q7lY https://t.co/GnenEraNBE",https://twitter.com/latercera,La Tercera,https://twitter.com/latercera/status/1394124744274948106,2021-09-06T18:43:50.061Z,https://twitter.com/search?q=from%3Alunadavid%20since%3A2021-04-01%20until%3A2021-06-30&src=typed_query&f=live
Fri May 07 12:55:43 +0000 2021,44740326,lunadavid,"Celebro que el día de hoy, sin egos y con ánimo constructivo, el gobierno escuche las preocupaciones y propuestas de partidos de oposición. 
El país necesita DIÁLOGO y consensos para lograr la RECONCILIACIÓN.",https://twitter.com/lunadavid,David Luna,https://twitter.com/lunadavid/status/1390651559424495616,2021-09-06T18:43:50.061Z,https://twitter.com/search?q=from%3Alunadavid%20since%3A2021-04-01%20until%3A2021-06-30&src=typed_query&f=live
Wed May 19 15:01:34 +0000 2021,44740326,lunadavid,"Entre el 19 y 23 de abril, https://t.co/tIrdb24y63 recibió 96 denuncias en contra de @grupovanti por cobros excesivos e injustos hacía los ciudadanos. Solo a 20 de ellos Vanti les dio respuesta, y tan solo TRES de estos casos fueron resueltos. #VantiResponda @SuperServicios https://t.co/z0BINjpJto",https://twitter.com/lunadavid,David Luna,https://twitter.com/lunadavid/status/1395031884237844488,2021-09-06T18:43:50.061Z,https://twitter.com/search?q=from%3Alunadavid%20since%3A2021-04-01%20until%3A2021-06-30&src=typed_query&f=live
Wed May 05 23:38:25 +0000 2021,44740326,lunadavid,"La invitación a dialogar debería ser aceptada por todos los sectores, sin condicionamiento alguno. 

El gobierno debería iniciar el diálogo con quienes piensan distinto a los que hoy gobiernan. 

El primer punto de acuerdo debe ser reconocer y promover que TODA  vida es sagrada.",https://twitter.com/lunadavid,David Luna,https://twitter.com/lunadavid/status/1390088526616727552,2021-09-06T18:43:50.061Z,https://twitter.com/search?q=from%3Alunadavid%20since%3A2021-04-01%20until%3A2021-06-30&src=typed_query&f=live
Wed May 05 02:21:17 +0000 2021,20560294,WRadioColombia,"#NoticiaW | A esta hora la Alcaldía de Bogotá reporta 15 CAI vandalizados, la mayoría en el sur de la ciudad. En el barrio la Aurora de Usme encendieron fuego con 10 policías adentro, quienes lograron salir; cinco de ellos resultaron heridos. &gt;&gt; https://t.co/AMNglsACd7 https://t.co/UA0cE3BIDm",https://twitter.com/WRadioColombia,W Radio Colombia,https://twitter.com/WRadioColombia/status/1389767122499289092,2021-09-06T18:43:50.061Z,https://twitter.com/search?q=from%3Alunadavid%20since%3A2021-04-01%20until%3A2021-06-30&src=typed_query&f=live
Wed May 12 22:08:43 +0000 2021,44740326,lunadavid,"#DialogarParaAvanzar es la esperanza para la reconciliación del país. Conectémonos este viernes, 3 pm🕒, al FB LIVE junto a @1AlfredoZamudio, director del Centro Noruego y @ZuluagaCamila. Debemos ser capaces de transformar pacíficamente el país, nos lo debemos, nos lo merecemos. https://t.co/jBLaNn25Qr",https://twitter.com/lunadavid,David Luna,https://twitter.com/lunadavid/status/1392602666170204160,2021-09-06T18:43:50.062Z,https://twitter.com/search?q=from%3Alunadavid%20since%3A2021-04-01%20until%3A2021-06-30&src=typed_query&f=live
Tue May 18 19:05:38 +0000 2021,44740326,lunadavid,"Santrich eligió la ilegalidad, el crimen y el narcotráfico... y así terminó sus días. 

Qué distinta hubiera sido su historia si le hubiera apostado a la paz, si hubiera reconocido sus delitos ante las víctimas y aportado a la reparación y no repetición del conflicto.",https://twitter.com/lunadavid,David Luna,https://twitter.com/lunadavid/status/1394730918431150084,2021-09-06T18:43:50.062Z,https://twitter.com/search?q=from%3Alunadavid%20since%3A2021-04-01%20until%3A2021-06-30&src=typed_query&f=live
Wed Apr 21 23:00:23 +0000 2021,44740326,lunadavid,"Yolanda Ríos tiene un local de servicio técnico en Rafael Uribe Uribe, pasó de pagar 95mil pesos por su servicio de agua a 426mil, un aumento del 348%. Señores @AcueductoBogota por favor escúchenla y resuelvanle. @NomasabusosCo #AcueductoResponda @PachoAlerta @Superservicios https://t.co/eYZrfFRjub",https://twitter.com/lunadavid,David Luna,https://twitter.com/lunadavid/status/1385005521477017601,2021-09-06T18:43:50.062Z,https://twitter.com/search?q=from%3Alunadavid%20since%3A2021-04-01%20until%3A2021-06-30&src=typed_query&f=live
Wed Apr 21 16:38:30 +0000 2021,44740326,lunadavid,"Juan Carlos Sanchez, vive solo en un apartamento en la localidad de Usaquen, su recibo de gas pasó de costar 5mil pesos a 263 mil, aumentó un 400%. No más abusos, respóndale a los ciudadanos #VantiResponda @grupovanti @Superservicios @PachoAlerta @NomasabusosCo https://t.co/sgHwqyDV0V",https://twitter.com/lunadavid,David Luna,https://twitter.com/lunadavid/status/1384909418949644289,2021-09-06T18:43:50.062Z,https://twitter.com/search?q=from%3Alunadavid%20since%3A2021-04-01%20until%3A2021-06-30&src=typed_query&f=live
Fri Apr 30 12:59:58 +0000 2021,44740326,lunadavid,"Son más de 300mil familias y 2millones de usuarios los que hoy le pedimos al Congreso que defienda el derecho a elegir que tiene el ciudadano a escoger en qué movilizarse, así como también el de obtener ingresos adicionales. ¡Llegó la hora de votar! #PlataformasReguladasYA https://t.co/O3nnIkbuQA",https://twitter.com/lunadavid,David Luna,https://twitter.com/lunadavid/status/1388115915233976325,2021-09-06T18:43:50.062Z,https://twitter.com/search?q=from%3Alunadavid%20since%3A2021-04-01%20until%3A2021-06-30&src=typed_query&f=live
Mon Apr 26 21:47:55 +0000 2021,44740326,lunadavid,"Hace unos días advertimos el cobro injusto por parte de @CodensaEnergia, quienes oportunamente se comunicaron con el señor Javier y dijeron no se seguiría realizando el cobro. Sin embargo, hoy llega el recibo con el mismo cobro y mucho más costoso. @Superservicios @PachoAlerta https://t.co/3abqm8UcCH",https://twitter.com/lunadavid,David Luna,https://twitter.com/lunadavid/status/1386799223505625091,2021-09-06T18:43:50.062Z,https://twitter.com/search?q=from%3Alunadavid%20since%3A2021-04-01%20until%3A2021-06-30&src=typed_query&f=live
Wed Apr 21 12:37:21 +0000 2021,44740326,lunadavid,"#AlAire con @PachoAlerta en @LaCarinosa610AM.Solo en 24 horas https://t.co/tIrdb24y63 recibió 286 quejas de ciudadanos desesperados por el mal servicio de las empresas de servicios públicos. 54 quejas sobre @grupovanti, 98 @CodensaEnergia y 134  @AcueductoBogota. @Superservicios https://t.co/KJhzhYcGmn",https://twitter.com/lunadavid,David Luna,https://twitter.com/lunadavid/status/1384848730969477121,2021-09-06T18:43:50.062Z,https://twitter.com/search?q=from%3Alunadavid%20since%3A2021-04-01%20until%3A2021-06-30&src=typed_query&f=live
Sun Apr 25 17:34:02 +0000 2021,44740326,lunadavid,"Esta semana #OpiniónConEvidencia tuvo 1500 visitas en https://t.co/29pnCsAHDk. Los invito a leerlo, vale la pena! @Alcentro_co https://t.co/I8Krofh7i4",https://twitter.com/lunadavid,David Luna,https://twitter.com/lunadavid/status/1386372945065529347,2021-09-06T18:43:50.062Z,https://twitter.com/search?q=from%3Alunadavid%20since%3A2021-04-01%20until%3A2021-06-30&src=typed_query&f=live
Thu Apr 22 13:48:02 +0000 2021,44740326,lunadavid,"En #MiTierra el 66% de los encuestados por el programa de Cambio Climático de @Yale afirma que el cuidado del medio ambiente debe ser una prioridad del Gobierno colombiano. Me uno a ellos, es urgente que los líderes mundiales enfoquen su agenda a afrontar la crisis climática. https://t.co/POn9YdpZJ1",https://twitter.com/lunadavid,David Luna,https://twitter.com/lunadavid/status/1385228908719714309,2021-09-06T18:43:50.062Z,https://twitter.com/search?q=from%3Alunadavid%20since%3A2021-04-01%20until%3A2021-06-30&src=typed_query&f=live
Sat Apr 24 15:02:00 +0000 2021,44740326,lunadavid,"#VantiResponda Don Milton tiene un restaurante en el barrio Toberín y por la pandemia sus ventas se redujeron en un 70%. @grupovanti nota el cambio en el consumo, dice que su contador está alterado y le cobra $26 millones de pesos. ¡No hay derecho! @Superservicios @PachoAlerta https://t.co/PNXGpD6cjX",https://twitter.com/lunadavid,David Luna,https://twitter.com/lunadavid/status/1385972297786433537,2021-09-06T18:43:50.062Z,https://twitter.com/search?q=from%3Alunadavid%20since%3A2021-04-01%20until%3A2021-06-30&src=typed_query&f=live
Fri Apr 23 18:57:12 +0000 2021,44740326,lunadavid,"Las vacunas escasean en todo el país y no podemos permitir más colados en el Plan Nacional de Vacunación, hay que denunciar y sancionar fuertemente a aquellos que lo hagan.  Los invito a escuchar mi intervención en @LaCarinosa610AM @PachoAlerta https://t.co/r8Y9KklnUX",https://twitter.com/lunadavid,David Luna,https://twitter.com/lunadavid/status/1385669099720675328,2021-09-06T18:43:50.062Z,https://twitter.com/search?q=from%3Alunadavid%20since%3A2021-04-01%20until%3A2021-06-30&src=typed_query&f=live
Tue Apr 20 16:38:24 +0000 2021,44740326,lunadavid,"En minutos, 12:00 pm 🕛  los invito a acompañarme en un nuevo #InTalks de @alianzain1. Hablaremos sobre #EconomiaColaborativa junto a @Lindapatcar, @jrodriguezk, @Solano y Matias Lanks. Los invito a verlo 👉🏻 https://t.co/1a1Xrragwi https://t.co/2oYLmTEXqQ",https://twitter.com/lunadavid,David Luna,https://twitter.com/lunadavid/status/1384547005079425025,2021-09-06T18:43:50.062Z,https://twitter.com/search?q=from%3Alunadavid%20since%3A2021-04-01%20until%3A2021-06-30&src=typed_query&f=live
Tue Apr 20 20:05:08 +0000 2021,44740326,lunadavid,"#VantiResponda A Juan Carlos Ovalle, de la loc. de Engativa, @grupovanti le desconectó su servicio a pesar de haber pagado en el plazo adecuado. Luego le cobran por la reconexión. Un error de ellos lo terminan pagando los ciudadanos. ¡No hay derecho! @Superservicios @PachoAlerta https://t.co/IosrqSeYmO",https://twitter.com/lunadavid,David Luna,https://twitter.com/lunadavid/status/1384599033738579970,2021-09-06T18:43:50.062Z,https://twitter.com/search?q=from%3Alunadavid%20since%3A2021-04-01%20until%3A2021-06-30&src=typed_query&f=live
Thu Apr 22 18:13:33 +0000 2021,44740326,lunadavid,"#CodensaResponda Javier Cardona, del barrio Mirandela, lleva 2 AÑOS pagando un seguro de vida de una persona que no conoce. Ha tratado de cancelar y @CodensaEnergia dice que si quiere seguir teniendo servicio de energía debe pagarlo. @NomasabusosCo @PachoAlerta @Superservicios https://t.co/rdSHnx3wic",https://twitter.com/lunadavid,David Luna,https://twitter.com/lunadavid/status/1385295728122204166,2021-09-06T18:43:50.062Z,https://twitter.com/search?q=from%3Alunadavid%20since%3A2021-04-01%20until%3A2021-06-30&src=typed_query&f=live
Wed Apr 21 12:06:08 +0000 2021,44740326,lunadavid,"Hoy @CriistanchO_o, parte del equipo de @alianzain1, recibe su título como Comunicador Social y Periodista. Todas mis felicitaciones y mis mejores deseos para los nuevos retos que comienzan.  👏🏻 🪅 🍾",https://twitter.com/lunadavid,David Luna,https://twitter.com/lunadavid/status/1384840875684122625,2021-09-06T18:43:50.062Z,https://twitter.com/search?q=from%3Alunadavid%20since%3A2021-04-01%20until%3A2021-06-30&src=typed_query&f=live
Sun May 02 19:27:33 +0000 2021,44740326,lunadavid,"Hundida la reforma todos debemos aportar a la reconciliacion, proponiendo ideas basadas en la evidencia y no en los intereses personales. @Alcentro_co pondrá en consideración un  #NUEVOACUERDO 🇨🇴, hoja de ruta solidaria y tecnológica para resolver los problemas de los ciudadanos.",https://twitter.com/lunadavid,David Luna,https://twitter.com/lunadavid/status/1388938229156651008,2021-09-06T18:43:50.062Z,https://twitter.com/search?q=from%3Alunadavid%20since%3A2021-04-01%20until%3A2021-06-30&src=typed_query&f=live
Wed Apr 28 15:10:11 +0000 2021,44740326,lunadavid,"Eduvina Caicedo vive en una casa estrato 2 en Suba y @acueductobogota le cobra UN MILLON 300 mil pesos. Pide que le revisen su medidor y la empresa dice que hay una falla que impide medir bien el consumo. Aún así, le siguen cobrando. Por favor, podrían atenderla? @PachoAlerta https://t.co/CFLWGZV7E7",https://twitter.com/lunadavid,David Luna,https://twitter.com/lunadavid/status/1387423909847445505,2021-09-06T18:43:50.062Z,https://twitter.com/search?q=from%3Alunadavid%20since%3A2021-04-01%20until%3A2021-06-30&src=typed_query&f=live
Fri Apr 30 00:05:02 +0000 2021,44740326,lunadavid,"@MauroToroO @ComVIcamara Los ciudadanos tienen derecho a elegir en qué movilizarse, en qué transportarse. Tienen derecho a saber cuánto les vale un viaje antes de montarse al carro, tienen derecho a aceptar o no la tarifa que le propone la tecnología.",https://twitter.com/lunadavid,David Luna,https://twitter.com/lunadavid/status/1387920895268769795,2021-09-06T18:43:50.062Z,https://twitter.com/search?q=from%3Alunadavid%20since%3A2021-04-01%20until%3A2021-06-30&src=typed_query&f=live
Sun May 02 03:34:19 +0000 2021,44740326,lunadavid,"Presidente @IvanDuque, retirar la reforma nunca será una derrota para usted, ni un triunfo para quien considera su contradictor. Será un acto de SOLIDARIDAD y HUMILDAD con el pueblo colombiano. Solo así podrá iniciar la RECONCILIACIÓN que el país necesita. #NoALaReformaTributaria",https://twitter.com/lunadavid,David Luna,https://twitter.com/lunadavid/status/1388698340381057026,2021-09-06T18:43:50.062Z,https://twitter.com/search?q=from%3Alunadavid%20since%3A2021-04-01%20until%3A2021-06-30&src=typed_query&f=live
Thu Apr 22 20:56:17 +0000 2021,44740326,lunadavid,"A propósito del #DiaDeLaTierra 🌎 🌱 los invito a seguir el Instagram live de “Chingonas Table”, hoy a las 5:00 pm. Un panel de mujeres maravillosas,  @Jamie_Margokun, speaker de @ONU_es, @getgaysoon, @vakentinastackl y @carolinaguerram, hablarán sobre el activismo climático 👇🏼 https://t.co/aJOIehJyXt",https://twitter.com/lunadavid,David Luna,https://twitter.com/lunadavid/status/1385336678286602241,2021-09-06T18:43:50.062Z,https://twitter.com/search?q=from%3Alunadavid%20since%3A2021-04-01%20until%3A2021-06-30&src=typed_query&f=live
Mon Apr 26 21:49:59 +0000 2021,44740326,lunadavid,"@codensaservicio @CodensaEnergia Hace unos días advertimos el cobro injusto por parte de @CodensaEnergia, quienes oportunamente se comunicaron con el señor Javier y dijeron no se seguiría realizando el cobro. Sin embargo, hoy llega el recibo con el mismo cobro y mucho más costoso. https://t.co/uxc2J5LNku https://t.co/REPcJ97GPI",https://twitter.com/lunadavid,David Luna,https://twitter.com/lunadavid/status/1386799744358490113,2021-09-06T18:43:50.062Z,https://twitter.com/search?q=from%3Alunadavid%20since%3A2021-04-01%20until%3A2021-06-30&src=typed_query&f=live
Tue Apr 20 21:09:33 +0000 2021,44740326,lunadavid,"#VantiResponda @grupovanti @Superservicios Luisa Escobar vive en un apartamento del barrio Tibabita junto a su hija de 7 años. De un mes a otro su cobro de gas aumentó en un 500%, pasó de pagar 34mil pesos a pagar 208mil pesos. Increíble, por favor resuelvan. @PachoAlerta https://t.co/53hsmbSW14",https://twitter.com/lunadavid,David Luna,https://twitter.com/lunadavid/status/1384615241770745858,2021-09-06T18:43:50.062Z,https://twitter.com/search?q=from%3Alunadavid%20since%3A2021-04-01%20until%3A2021-06-30&src=typed_query&f=live
Fri Apr 16 00:02:15 +0000 2021,2168589320,Alcentro_co,"El gobierno nacional radicó una nueva #ReformaTributaria. En este episodio de #20MinsConDL @trujilloseb, director de Economía Internacional explica por qué debe tramitarse y @lunadavid por qué la considera inconveniente. Modera: @_Mpforero @AkordeMedia 👉 https://t.co/6jwnl1KvQK https://t.co/PXKcdjrn6j",https://twitter.com/Alcentro_co,Alcentro,https://twitter.com/Alcentro_co/status/1382846766207340545,2021-09-06T18:43:50.062Z,https://twitter.com/search?q=from%3Alunadavid%20since%3A2021-04-01%20until%3A2021-06-30&src=typed_query&f=live
Wed Apr 14 14:30:58 +0000 2021,44740326,lunadavid,"Hace 14 años impulsé la Ley del diésel para poder respirar un mejor aire. Hoy celebro que @colinita y @ambientebogota estén lanzando y adoptando el Plan Aire 2030, el cual incorporará tecnologías limpias para reducir las emisiones contaminantes. #UnidosPorUnNuevoAire https://t.co/iD3J6zkIvy",https://twitter.com/lunadavid,David Luna,https://twitter.com/lunadavid/status/1382340607222411267,2021-09-06T18:43:50.062Z,https://twitter.com/search?q=from%3Alunadavid%20since%3A2021-04-01%20until%3A2021-06-30&src=typed_query&f=live
Mon Apr 12 16:51:25 +0000 2021,44740326,lunadavid,"""Después de tantos años y tantos intentos por la regulación de las plataformas de movilidad, al fin parece que hay un camino que dice que se está escuchando a los usuarios"". Los invito a leer mi nueva columna de opinión para @elespectador #AppsReguladasYA https://t.co/e05yttLJOP",https://twitter.com/lunadavid,David Luna,https://twitter.com/lunadavid/status/1381651177197166592,2021-09-06T18:43:50.062Z,https://twitter.com/search?q=from%3Alunadavid%20since%3A2021-04-01%20until%3A2021-06-30&src=typed_query&f=live
Mon Apr 12 20:30:56 +0000 2021,44740326,lunadavid,"“Es preocupante el aumento en los casos y muertes que se presentan en este tercer pico. Hay que cuidarnos, entender que hay unas restricciones que se deben cumplir a cabalidad”. Mi opinión en @LaCarinosa610AM @PachoAlerta https://t.co/jvlXOxgJHl",https://twitter.com/lunadavid,David Luna,https://twitter.com/lunadavid/status/1381706423407685634,2021-09-06T18:43:50.062Z,https://twitter.com/search?q=from%3Alunadavid%20since%3A2021-04-01%20until%3A2021-06-30&src=typed_query&f=live
Mon Apr 19 16:56:17 +0000 2021,44740326,lunadavid,"Hoy en @EcosdelCombeima junto a Julio Montiel y Juan Pablo Sánchez, hablamos sobre la ponencia que busca regular las #PlataformasDeMovilidad y sobre #AppsReguladasYa. Los invito a escuchar mi intervención 👉🏼https://t.co/dMllwhkeYz",https://twitter.com/lunadavid,David Luna,https://twitter.com/lunadavid/status/1384189120340058126,2021-09-06T18:43:50.062Z,https://twitter.com/search?q=from%3Alunadavid%20since%3A2021-04-01%20until%3A2021-06-30&src=typed_query&f=live
Thu Apr 08 19:39:16 +0000 2021,44740326,lunadavid,"Los recursos públicos son sagrados, hay que tener mayor control, veeduría y vigilancia sobre ellos para que se manejen de manera correcta y se no malgasten. Los invito a escuchar mi opinión en @LaCarinosa610AM @PachoAlerta https://t.co/CSodiXc8tO https://t.co/pmoOsxCKVj",https://twitter.com/lunadavid,David Luna,https://twitter.com/lunadavid/status/1380243867321110529,2021-09-06T18:43:50.062Z,https://twitter.com/search?q=from%3Alunadavid%20since%3A2021-04-01%20until%3A2021-06-30&src=typed_query&f=live
Fri Apr 16 20:51:49 +0000 2021,44740326,lunadavid,"@DianitaPGg Apreciada @DianitaPGg, muchas gracias por contarme tu caso. ¿Por dónde puedo comunicarme contigo y saber más sobre las solicitudes que haz realizado?",https://twitter.com/lunadavid,David Luna,https://twitter.com/lunadavid/status/1383161230467141638,2021-09-06T18:43:50.062Z,https://twitter.com/search?q=from%3Alunadavid%20since%3A2021-04-01%20until%3A2021-06-30&src=typed_query&f=live
Sat Apr 17 14:59:17 +0000 2021,44740326,lunadavid,"El martes 20 de abril a las 12:00 pm 🕛 los invito a acompañarme en un nuevo #InTalks de @alianzain1. Hablaremos sobre #EconomiaColaborativa junto a @Lindapatcar, @jrodriguezk, @Solano y Matias Lanks. Inscripciones 👉🏼https://t.co/jZFVklJEgT https://t.co/ITfwA04ksl",https://twitter.com/lunadavid,David Luna,https://twitter.com/lunadavid/status/1383434898464149508,2021-09-06T18:43:50.062Z,https://twitter.com/search?q=from%3Alunadavid%20since%3A2021-04-01%20until%3A2021-06-30&src=typed_query&f=live
Fri Apr 16 13:12:01 +0000 2021,44740326,lunadavid,Muy merecido @PachoAlerta y todo el equipo de @LaCarinosa610AM !!!,https://twitter.com/lunadavid,David Luna,https://twitter.com/lunadavid/status/1383045517232455680,2021-09-06T18:43:50.062Z,https://twitter.com/search?q=from%3Alunadavid%20since%3A2021-04-01%20until%3A2021-06-30&src=typed_query&f=live
