tweetDate,twitterId,handle,text,profileUrl,name,tweetLink,timestamp,query
Fri May 14 23:03:34 +0000 2021,25185308,sergio_fajardo,"En medio de esta crisis, el covid no da tregua. Las UCIs al límite y el cuerpo sanitario exhausto tras 15 meses de trabajo tenaz. Cada día sumamos centenares de muertes que tienen al país en un duelo profundo. No podemos bajar la guardia. Este fin de semana necesitamos cuidarnos.",https://twitter.com/sergio_fajardo,Sergio Fajardo,https://twitter.com/sergio_fajardo/status/1393341245498535945,2021-09-06T20:03:09.574Z,https://twitter.com/search?q=from%3Asergio_fajardo%20since%3A2021-04-01%20until%3A2021-06-30&src=typed_query&f=live
Thu May 13 22:32:56 +0000 2021,25185308,sergio_fajardo,Lucas y Jesús | Un Pasquín https://t.co/3vNM9pmvha vía @UnPasquin,https://twitter.com/sergio_fajardo,Sergio Fajardo,https://twitter.com/sergio_fajardo/status/1392971148820877318,2021-09-06T20:03:09.574Z,https://twitter.com/search?q=from%3Asergio_fajardo%20since%3A2021-04-01%20until%3A2021-06-30&src=typed_query&f=live
Wed May 12 23:55:11 +0000 2021,25185308,sergio_fajardo,"2) Los ingresos por matrículas son 1.1 billones al año, de los cuales cerca de 700 mil millones son de estudiantes de estratos 1, 2 y 3. Hay que poner estos recursos y muchos más.",https://twitter.com/sergio_fajardo,Sergio Fajardo,https://twitter.com/sergio_fajardo/status/1392629458109181962,2021-09-06T20:03:09.574Z,https://twitter.com/search?q=from%3Asergio_fajardo%20since%3A2021-04-01%20until%3A2021-06-30&src=typed_query&f=live
Wed May 12 23:56:23 +0000 2021,25185308,sergio_fajardo,"5) Hay corrupción en varias instituciones de educación superior pública, como la Universidad del Pacífico, y no hay un plan serio para atacar el problema.",https://twitter.com/sergio_fajardo,Sergio Fajardo,https://twitter.com/sergio_fajardo/status/1392629759876739072,2021-09-06T20:03:09.574Z,https://twitter.com/search?q=from%3Asergio_fajardo%20since%3A2021-04-01%20until%3A2021-06-30&src=typed_query&f=live
Fri May 14 12:33:53 +0000 2021,25185308,sergio_fajardo,"Necesitamos una Policía con espíritu crítico y capacidad de reformarse. Presidente Duque, ministro Molano y general Vargas promuevan el cambio. El camino es reconocer los problemas y  recuperar la confianza. La gente necesita sentirse protegida por la fuerza pública, no agredida.",https://twitter.com/sergio_fajardo,Sergio Fajardo,https://twitter.com/sergio_fajardo/status/1393182778724954115,2021-09-06T20:03:09.574Z,https://twitter.com/search?q=from%3Asergio_fajardo%20since%3A2021-04-01%20until%3A2021-06-30&src=typed_query&f=live
Wed May 12 23:51:48 +0000 2021,25185308,sergio_fajardo,"La demanda por una mayor cobertura no se está resolviendo. De 2017 a 2019 la cobertura se estancó. Además, en el segundo semestre del 2020 cayó la matrícula en 11%. Peores cifras están por verse.",https://twitter.com/sergio_fajardo,Sergio Fajardo,https://twitter.com/sergio_fajardo/status/1392628609274327040,2021-09-06T20:03:09.574Z,https://twitter.com/search?q=from%3Asergio_fajardo%20since%3A2021-04-01%20until%3A2021-06-30&src=typed_query&f=live
Sat May 15 18:18:48 +0000 2021,20560294,WRadioColombia,"#NoticiaW | Conmovido el alcalde de Jamundí, Andrés Felipe Ramírez, le pidió a las autoridades esclarecer los hechos vandálicos contra la Alcaldía y el Concejo municipal ocurridos en la madrugada de este sábado https://t.co/AMNglsACd7 https://t.co/QfMIKSu6dQ",https://twitter.com/WRadioColombia,W Radio Colombia,https://twitter.com/WRadioColombia/status/1393631969641222145,2021-09-06T20:03:09.574Z,https://twitter.com/search?q=from%3Asergio_fajardo%20since%3A2021-04-01%20until%3A2021-06-30&src=typed_query&f=live
Wed May 12 23:55:42 +0000 2021,25185308,sergio_fajardo,3) La anunciada reforma del ICETEX trae soluciones incompletas. Los estudiantes de bajos y medios ingresos en las universidades privadas no han tenido soluciones estructurales o ayudas.,https://twitter.com/sergio_fajardo,Sergio Fajardo,https://twitter.com/sergio_fajardo/status/1392629589525078018,2021-09-06T20:03:09.574Z,https://twitter.com/search?q=from%3Asergio_fajardo%20since%3A2021-04-01%20until%3A2021-06-30&src=typed_query&f=live
Fri May 14 16:11:38 +0000 2021,137908875,ClaudiaLopez,"Queridos. Los médicos me han informado que tengo COVID19 y me han ordenado aislamiento y reposo.

Aunque seguiré pendiente de todos, por precaución quedará encargado en funciones el Secretario de Salud, Alejandro Gómez.

La concertación y el cuidado es el camino. Todo saldrá bien https://t.co/N6INP1AEe2",https://twitter.com/ClaudiaLopez,Claudia López 👍,https://twitter.com/ClaudiaLopez/status/1393237577025609731,2021-09-06T20:03:09.574Z,https://twitter.com/search?q=from%3Asergio_fajardo%20since%3A2021-04-01%20until%3A2021-06-30&src=typed_query&f=live
Thu May 13 01:51:07 +0000 2021,25185308,sergio_fajardo,Lo dije en 2018 y me sostengo. Las propuestas de gasto sin fuentes de financiación no son más que castillos en el aire. La gratuidad en la educación es el camino y debemos resolver su financiación. https://t.co/U3XVMz6iRY,https://twitter.com/sergio_fajardo,Sergio Fajardo,https://twitter.com/sergio_fajardo/status/1392658632702140421,2021-09-06T20:03:09.574Z,https://twitter.com/search?q=from%3Asergio_fajardo%20since%3A2021-04-01%20until%3A2021-06-30&src=typed_query&f=live
Sat May 15 13:50:20 +0000 2021,25185308,sergio_fajardo,"Hoy, en su día, debemos reflexionar sobre el rol central de los y las maestras en el diálogo con jóvenes que, con razón, reclaman oportunidades. Debemos reconocer su importancia y garantizarles trato digno, salarios justos, formación de calidad y mejores condiciones para enseñar.",https://twitter.com/sergio_fajardo,Sergio Fajardo,https://twitter.com/sergio_fajardo/status/1393564408111063057,2021-09-06T20:03:09.574Z,https://twitter.com/search?q=from%3Asergio_fajardo%20since%3A2021-04-01%20until%3A2021-06-30&src=typed_query&f=live
Wed May 12 23:53:03 +0000 2021,25185308,sergio_fajardo,"La matrícula gratuita para los estudiantes de estratos 1, 2 y 3 por un semestre es un avance en esta coyuntura. Creo además que una vez planteada la gratuidad, no se podrá volver al modelo anterior. Es un avance, pero no sustituye una reforma estructural.",https://twitter.com/sergio_fajardo,Sergio Fajardo,https://twitter.com/sergio_fajardo/status/1392628921900879872,2021-09-06T20:03:09.574Z,https://twitter.com/search?q=from%3Asergio_fajardo%20since%3A2021-04-01%20until%3A2021-06-30&src=typed_query&f=live
Sat May 15 23:33:29 +0000 2021,25185308,sergio_fajardo,"La situación de Popayán es crítica, la violencia contra los jóvenes debe parar ya, al igual que los ataques contra la libertad de prensa. Clave abrir diálogos con jóvenes e investigar el aberrante caso de Allison. https://t.co/GNH8ddXEDA",https://twitter.com/sergio_fajardo,Sergio Fajardo,https://twitter.com/sergio_fajardo/status/1393711162852794368,2021-09-06T20:03:09.574Z,https://twitter.com/search?q=from%3Asergio_fajardo%20since%3A2021-04-01%20until%3A2021-06-30&src=typed_query&f=live
Fri May 14 16:32:50 +0000 2021,25185308,sergio_fajardo,"Querida Claudia, recupérate pronto que Bogotá te necesita.",https://twitter.com/sergio_fajardo,Sergio Fajardo,https://twitter.com/sergio_fajardo/status/1393242912079687682,2021-09-06T20:03:09.574Z,https://twitter.com/search?q=from%3Asergio_fajardo%20since%3A2021-04-01%20until%3A2021-06-30&src=typed_query&f=live
Wed May 12 23:54:34 +0000 2021,25185308,sergio_fajardo,Varios pensamientos: 1) Hay que refinanciar las universidades para poder generar más cupos. El costo de un estudiante en una institución pública no es sólo lo que paga en la matrícula.,https://twitter.com/sergio_fajardo,Sergio Fajardo,https://twitter.com/sergio_fajardo/status/1392629303263875072,2021-09-06T20:03:09.574Z,https://twitter.com/search?q=from%3Asergio_fajardo%20since%3A2021-04-01%20until%3A2021-06-30&src=typed_query&f=live
Sat May 15 23:30:41 +0000 2021,25185308,sergio_fajardo,"En Jamundí los jóvenes son pacíficos y están dialogando. Nunca han abandonado la protesta, pero lo hacen sin violencia. Un grupo criminal decidió incendiarlo todo y deslegitimar un proceso sano. No es justo con esos jóvenes, hay que rodear a Jamundí con verdad y justicia.",https://twitter.com/sergio_fajardo,Sergio Fajardo,https://twitter.com/sergio_fajardo/status/1393710457140154368,2021-09-06T20:03:09.574Z,https://twitter.com/search?q=from%3Asergio_fajardo%20since%3A2021-04-01%20until%3A2021-06-30&src=typed_query&f=live
Wed May 12 23:52:22 +0000 2021,25185308,sergio_fajardo,Además hay que pararse en las realidades de los estratos más bajos. Vienen con una preparación deficiente y ahí ya se reducen las posibilidades de “pelear” por un cupo. Y muchos de los que pasan deben estudiar y trabajar para sostenerse.,https://twitter.com/sergio_fajardo,Sergio Fajardo,https://twitter.com/sergio_fajardo/status/1392628751310143490,2021-09-06T20:03:09.574Z,https://twitter.com/search?q=from%3Asergio_fajardo%20since%3A2021-04-01%20until%3A2021-06-30&src=typed_query&f=live
Fri May 14 12:34:01 +0000 2021,25185308,sergio_fajardo,"Dejemos de pretender que acá no pasa nada y que podemos ver fútbol en paz. Mientras insisten en hacer creer que todo está bien, llegan cada día más denuncias de violencia sexual de la policía. Los casos de varias menores en Popayán son inaceptables y no pueden quedar impunes.",https://twitter.com/sergio_fajardo,Sergio Fajardo,https://twitter.com/sergio_fajardo/status/1393182812770115586,2021-09-06T20:03:09.574Z,https://twitter.com/search?q=from%3Asergio_fajardo%20since%3A2021-04-01%20until%3A2021-06-30&src=typed_query&f=live
Wed May 05 19:31:09 +0000 2021,25185308,sergio_fajardo,"Con la confianza de que la verdad y la decencia siempre salen adelante, hoy asistí a una audiencia ante el Tribunal Superior de Bogotá. https://t.co/qvnJLGRWtK",https://twitter.com/sergio_fajardo,Sergio Fajardo,https://twitter.com/sergio_fajardo/status/1390026298014187521,2021-09-06T20:03:09.574Z,https://twitter.com/search?q=from%3Asergio_fajardo%20since%3A2021-04-01%20until%3A2021-06-30&src=typed_query&f=live
Tue May 04 23:19:15 +0000 2021,25185308,sergio_fajardo,"@mariapcorrea @santiagoangelp Doctora Correa, en esta carta encuentra nuestras razones para no asistir. La violencia en las calles debe parar antes de cualquier diálogo sobre la reforma tributaria: primero la vida. La disposición a dialogar sigue abierta. https://t.co/Nff242vRuf",https://twitter.com/sergio_fajardo,Sergio Fajardo,https://twitter.com/sergio_fajardo/status/1389721313753849860,2021-09-06T20:03:09.574Z,https://twitter.com/search?q=from%3Asergio_fajardo%20since%3A2021-04-01%20until%3A2021-06-30&src=typed_query&f=live
Fri May 07 16:38:40 +0000 2021,25185308,sergio_fajardo,"Hay que escuchar las voces de quienes no tienen la oportunidad de venir a Palacio. El presidente debe ir a Cali, que es el símbolo de lo que está sucediendo, convocar a jóvenes, grupos comunitarios, empresarios y otras personas. Hay que escuchar. Más diálogo con la calle. https://t.co/izYoKkg4zY",https://twitter.com/sergio_fajardo,Sergio Fajardo,https://twitter.com/sergio_fajardo/status/1390707668663377920,2021-09-06T20:03:09.574Z,https://twitter.com/search?q=from%3Asergio_fajardo%20since%3A2021-04-01%20until%3A2021-06-30&src=typed_query&f=live
Wed May 05 21:14:56 +0000 2021,137908875,ClaudiaLopez,"La salida pacífica a esta crisis está en que el gobierno nacional reconozca a los jóvenes que están marchando, reconozca su legitimidad, su vocería propia, reconozca los abusos de lado y lado y dé garantías para frenar la violencia y pasar a una auténtica concertación con ellos. https://t.co/84poIHOvNT",https://twitter.com/ClaudiaLopez,Claudia López 👍,https://twitter.com/ClaudiaLopez/status/1390052416775757833,2021-09-06T20:03:09.574Z,https://twitter.com/search?q=from%3Asergio_fajardo%20since%3A2021-04-01%20until%3A2021-06-30&src=typed_query&f=live
Thu May 06 23:30:05 +0000 2021,25185308,sergio_fajardo,Mañana #CoaliciónDeLaEsperanza sostendrá reunión con el presidente Iván Duque. Pronunciamiento conjunto 7:30 a.m. https://t.co/CHZFWkug1Y,https://twitter.com/sergio_fajardo,Sergio Fajardo,https://twitter.com/sergio_fajardo/status/1390448815094829060,2021-09-06T20:03:09.574Z,https://twitter.com/search?q=from%3Asergio_fajardo%20since%3A2021-04-01%20until%3A2021-06-30&src=typed_query&f=live
Sun May 09 22:45:53 +0000 2021,25185308,sergio_fajardo,"En un gesto democrático, la #CoaliciónDeLaEsperanza se reunió con el presidente Iván Duque. Aceptamos la invitación para dejarle claro al presidente que debe salir de la casa de Nariño para negociar con la gente y poner fin a la violencia en las calles.",https://twitter.com/sergio_fajardo,Sergio Fajardo,https://twitter.com/sergio_fajardo/status/1391524854122360836,2021-09-06T20:03:09.574Z,https://twitter.com/search?q=from%3Asergio_fajardo%20since%3A2021-04-01%20until%3A2021-06-30&src=typed_query&f=live
Sun May 09 22:45:53 +0000 2021,25185308,sergio_fajardo,"La Coalición de la Esperanza es una coalición amplia donde las diferencias se dirimen de manera pacífica. Estamos abiertos al diálogo y la crítica. Sin embargo, condenamos la violencia con la que en redes algunos sectores han recibido nuestro gesto. Algunas reflexiones:",https://twitter.com/sergio_fajardo,Sergio Fajardo,https://twitter.com/sergio_fajardo/status/1391524855821082626,2021-09-06T20:03:09.574Z,https://twitter.com/search?q=from%3Asergio_fajardo%20since%3A2021-04-01%20until%3A2021-06-30&src=typed_query&f=live
Sat May 08 17:56:27 +0000 2021,25185308,sergio_fajardo,"Presidente @IvanDuque, le reitero lo que le dijimos ayer. Vaya y gobierne en las regiones para las regiones. Cali sigue esperando ¿hasta cuándo? https://t.co/9jz5quGNJW",https://twitter.com/sergio_fajardo,Sergio Fajardo,https://twitter.com/sergio_fajardo/status/1391089629256982531,2021-09-06T20:03:09.574Z,https://twitter.com/search?q=from%3Asergio_fajardo%20since%3A2021-04-01%20until%3A2021-06-30&src=typed_query&f=live
Tue May 11 12:00:15 +0000 2021,25185308,sergio_fajardo,Ninguna familia debe pasar por el dolor que atraviesa la familia de Lucas Villa hoy. Su asesinato nos debe servir de testimonio del país al que no queremos volver. Honremos a Lucas luchando por un país en el que podamos manifestar nuestras diferencias sin que nos cueste la vida.,https://twitter.com/sergio_fajardo,Sergio Fajardo,https://twitter.com/sergio_fajardo/status/1392087154373931014,2021-09-06T20:03:09.574Z,https://twitter.com/search?q=from%3Asergio_fajardo%20since%3A2021-04-01%20until%3A2021-06-30&src=typed_query&f=live
Mon May 10 17:41:17 +0000 2021,25185308,sergio_fajardo,"Lo criticaban por llorar, por no ser el hombre de la mano dura. Cuánta razón tenía Armitage, ex alcalde de Cali, empresario existoso. “Aquí sabemos matarnos, pero lo que no sabemos es distribuir el ingreso”. https://t.co/p9te204OsO",https://twitter.com/sergio_fajardo,Sergio Fajardo,https://twitter.com/sergio_fajardo/status/1391810588813185029,2021-09-06T20:03:09.574Z,https://twitter.com/search?q=from%3Asergio_fajardo%20since%3A2021-04-01%20until%3A2021-06-30&src=typed_query&f=live
Wed May 05 10:24:10 +0000 2021,25185308,sergio_fajardo,"La indignación y el dolor de la ciudadanía son ciertos, legítimos... https://t.co/raqPE8YHwK",https://twitter.com/sergio_fajardo,Sergio Fajardo,https://twitter.com/sergio_fajardo/status/1389888643398053888,2021-09-06T20:03:09.574Z,https://twitter.com/search?q=from%3Asergio_fajardo%20since%3A2021-04-01%20until%3A2021-06-30&src=typed_query&f=live
Sat May 08 00:03:58 +0000 2021,25185308,sergio_fajardo,"Space a las 7:30 p.m. con @Fernandoposada_ 
#CoaliciónDeLaEsperanza https://t.co/2CkGDbB5CQ",https://twitter.com/sergio_fajardo,Sergio Fajardo,https://twitter.com/sergio_fajardo/status/1390819730726998022,2021-09-06T20:03:09.574Z,https://twitter.com/search?q=from%3Asergio_fajardo%20since%3A2021-04-01%20until%3A2021-06-30&src=typed_query&f=live
Sun May 09 22:45:54 +0000 2021,25185308,sergio_fajardo,"Y, por último: la violenta represión de la Fuerza Pública debe ser controlada de forma inmediata por el Gobierno Nacional. No podemos continuar hacia el peor escenario: 
El rencor generado nos puede llevar a la confrontación entre hermanos. 
El camino es el diálogo ya.",https://twitter.com/sergio_fajardo,Sergio Fajardo,https://twitter.com/sergio_fajardo/status/1391524860980043781,2021-09-06T20:03:09.574Z,https://twitter.com/search?q=from%3Asergio_fajardo%20since%3A2021-04-01%20until%3A2021-06-30&src=typed_query&f=live
Fri May 07 14:12:01 +0000 2021,25185308,sergio_fajardo,Declaración de la #CoaliciondelaEsperanza sobre su reunión con el presidente Duque. https://t.co/L8uqRNP62Z,https://twitter.com/sergio_fajardo,Sergio Fajardo,https://twitter.com/sergio_fajardo/status/1390670763095695362,2021-09-06T20:03:09.574Z,https://twitter.com/search?q=from%3Asergio_fajardo%20since%3A2021-04-01%20until%3A2021-06-30&src=typed_query&f=live
Wed May 12 23:49:33 +0000 2021,25185308,sergio_fajardo,"Se le hizo tarde a este gobierno para plantear y ejecutar soluciones estructurales para la educación superior. Por la presión de los jóvenes hace un anuncio importante, pero es una medida de corto plazo. Colombia sigue sin una propuesta integral de educación.",https://twitter.com/sergio_fajardo,Sergio Fajardo,https://twitter.com/sergio_fajardo/status/1392628041852071936,2021-09-06T20:03:09.574Z,https://twitter.com/search?q=from%3Asergio_fajardo%20since%3A2021-04-01%20until%3A2021-06-30&src=typed_query&f=live
Sun May 09 22:45:53 +0000 2021,25185308,sergio_fajardo,"Le reiteramos al presidente Duque que abra el diálogo personalmente en Cali, urgente, sin intermediarios. Que hable con los ciudadanos, en las calles. 
Presidente, cada día que pasa es una tragedia para la ciudad.",https://twitter.com/sergio_fajardo,Sergio Fajardo,https://twitter.com/sergio_fajardo/status/1391524857511399429,2021-09-06T20:03:09.574Z,https://twitter.com/search?q=from%3Asergio_fajardo%20since%3A2021-04-01%20until%3A2021-06-30&src=typed_query&f=live
Tue May 11 11:38:53 +0000 2021,17813487,NoticiasCaracol,"#LoÚltimo | Murió Lucas Villa: familia confirma la noticia. 

Tras luchar cinco días contra la gravedad de las heridas que le propinaron, perdió la batalla - https://t.co/xIbz3tXGPg https://t.co/Y2dpn6D4Bz",https://twitter.com/NoticiasCaracol,Noticias Caracol,https://twitter.com/NoticiasCaracol/status/1392081774642139141,2021-09-06T20:03:09.574Z,https://twitter.com/search?q=from%3Asergio_fajardo%20since%3A2021-04-01%20until%3A2021-06-30&src=typed_query&f=live
Wed May 12 02:00:55 +0000 2021,25185308,sergio_fajardo,"Presidente @IvanDuque , de una vez y para siempre (no solo por este semestre): Universidad pública gratuita para estratos 1, 2, 3 y 4. Ya.",https://twitter.com/sergio_fajardo,Sergio Fajardo,https://twitter.com/sergio_fajardo/status/1392298714207866884,2021-09-06T20:03:09.574Z,https://twitter.com/search?q=from%3Asergio_fajardo%20since%3A2021-04-01%20until%3A2021-06-30&src=typed_query&f=live
Thu May 06 01:05:42 +0000 2021,25185308,sergio_fajardo,Una declaración sensata que vale la pena escuchar. Por ahí es la ruta.,https://twitter.com/sergio_fajardo,Sergio Fajardo,https://twitter.com/sergio_fajardo/status/1390110490479693825,2021-09-06T20:03:09.574Z,https://twitter.com/search?q=from%3Asergio_fajardo%20since%3A2021-04-01%20until%3A2021-06-30&src=typed_query&f=live
Wed May 12 23:49:54 +0000 2021,25185308,sergio_fajardo,"Estoy de acuerdo con @marialopezuribe: NO HAY CUPO PA´TANTA GENTE. Tenemos colapso en la oferta, no de demanda. ¿Cómo van a superar las universidades el problema de oferta? Esa es la gran pregunta.",https://twitter.com/sergio_fajardo,Sergio Fajardo,https://twitter.com/sergio_fajardo/status/1392628130062520322,2021-09-06T20:03:09.574Z,https://twitter.com/search?q=from%3Asergio_fajardo%20since%3A2021-04-01%20until%3A2021-06-30&src=typed_query&f=live
Thu May 06 13:21:32 +0000 2021,25185308,sergio_fajardo,No podemos seguir viendo tragedias como la de Lucas Villa. No podemos responder a los llamados irresponsables por más violencia. Esa frase tan infame cada vez más evidente: “bala es lo que hay”. Aquí nos está matando el odio que se promovió durante años.,https://twitter.com/sergio_fajardo,Sergio Fajardo,https://twitter.com/sergio_fajardo/status/1390295668736946180,2021-09-06T20:03:09.574Z,https://twitter.com/search?q=from%3Asergio_fajardo%20since%3A2021-04-01%20until%3A2021-06-30&src=typed_query&f=live
Sun May 09 22:45:54 +0000 2021,25185308,sergio_fajardo,"Por su parte los bloqueos están afectando en forma desproporcionada a la población. Líderes locales deberían valorar la situación y tomar decisiones que eviten esos efectos injustificados, que terminarán por quitarle el respaldo de la ciudadanía a la justa protesta.",https://twitter.com/sergio_fajardo,Sergio Fajardo,https://twitter.com/sergio_fajardo/status/1391524859243552768,2021-09-06T20:03:09.574Z,https://twitter.com/search?q=from%3Asergio_fajardo%20since%3A2021-04-01%20until%3A2021-06-30&src=typed_query&f=live
Thu Apr 29 18:07:59 +0000 2021,25185308,sergio_fajardo,"El presidente de Chile Sebastián Piñera dijo "" Chile es el oasis de América Latina"". A los pocos días, en las calles de su país se acabó el Modelo Chileno.
Después Piñera dijo ""no escuchamos"".
Presidente Duque, escuche las lecciones de la historia. Rápido.",https://twitter.com/sergio_fajardo,Sergio Fajardo,https://twitter.com/sergio_fajardo/status/1387831042300682240,2021-09-06T20:03:09.574Z,https://twitter.com/search?q=from%3Asergio_fajardo%20since%3A2021-04-01%20until%3A2021-06-30&src=typed_query&f=live
Thu Apr 29 00:10:40 +0000 2021,19236074,CaracolRadio,"#Bogotá | Cacerolazo en Suba como parte de la protesta contra la reforma tributaria planteada por el Gobierno Nacional.

Siga el minuto a minuto en: https://t.co/1w7TutV7o8 https://t.co/IQPyz0vi9e",https://twitter.com/CaracolRadio,Caracol Radio,https://twitter.com/CaracolRadio/status/1387559925379960835,2021-09-06T20:03:09.574Z,https://twitter.com/search?q=from%3Asergio_fajardo%20since%3A2021-04-01%20until%3A2021-06-30&src=typed_query&f=live
Thu Apr 29 12:41:11 +0000 2021,25185308,sergio_fajardo,#ADuqueLeDigo,https://twitter.com/sergio_fajardo,Sergio Fajardo,https://twitter.com/sergio_fajardo/status/1387748797401403395,2021-09-06T20:03:09.574Z,https://twitter.com/search?q=from%3Asergio_fajardo%20since%3A2021-04-01%20until%3A2021-06-30&src=typed_query&f=live
Fri Apr 30 18:55:29 +0000 2021,25185308,sergio_fajardo,"El caso de Cali no es aislado. El Pacífico ha sido históricamente la región más pobre y abandonada por el Estado. Es una región plagada por la minería ilegal, el narcotráfico y la violencia. Presidente, si no escucha hoy a Cali y actúa, el malestar en la región seguirá creciendo.",https://twitter.com/sergio_fajardo,Sergio Fajardo,https://twitter.com/sergio_fajardo/status/1388205381743173632,2021-09-06T20:03:09.574Z,https://twitter.com/search?q=from%3Asergio_fajardo%20since%3A2021-04-01%20until%3A2021-06-30&src=typed_query&f=live
Sun May 02 18:14:57 +0000 2021,25185308,sergio_fajardo,"¡Triunfo de la movilización ciudadana! Por fin escuchó el Presidente.

Ahora el paso más importante: diálogo amplio y serio con todas las expresiones sufridas, indignadas y adoloridas por las desigualdades y la corrupción.

Desde la #CoaliciónDeLaEsperanza proponemos👇🏽 https://t.co/0yUsQrSLOl",https://twitter.com/sergio_fajardo,Sergio Fajardo,https://twitter.com/sergio_fajardo/status/1388919959435231235,2021-09-06T20:03:09.574Z,https://twitter.com/search?q=from%3Asergio_fajardo%20since%3A2021-04-01%20until%3A2021-06-30&src=typed_query&f=live
Thu Apr 29 01:02:52 +0000 2021,25185308,sergio_fajardo,Suena fuerte el #Cacerolazo28A en muchas ciudades. La ciudadanía recordándole al gobierno que su primera tarea es escuchar.,https://twitter.com/sergio_fajardo,Sergio Fajardo,https://twitter.com/sergio_fajardo/status/1387573061982072832,2021-09-06T20:03:09.574Z,https://twitter.com/search?q=from%3Asergio_fajardo%20since%3A2021-04-01%20until%3A2021-06-30&src=typed_query&f=live
Sun May 02 23:25:26 +0000 2021,25185308,sergio_fajardo,"El retiro de la tributaria es sólo el comienzo. Además de esclarecer los asesinatos, los abusos de autoridad y el vandalismo, es hora de un diálogo social amplio y no de políticos en Palacio. Escuchar para construir un plan social de emergencia. https://t.co/zDUiEqa9OP",https://twitter.com/sergio_fajardo,Sergio Fajardo,https://twitter.com/sergio_fajardo/status/1388998095564906497,2021-09-06T20:03:09.574Z,https://twitter.com/search?q=from%3Asergio_fajardo%20since%3A2021-04-01%20until%3A2021-06-30&src=typed_query&f=live
Fri Apr 30 18:54:44 +0000 2021,25185308,sergio_fajardo,"En Cali se está mezclando la pobreza, la falta de atención a rezagos sociales profundos, con delincuencia estimulada por el narcotráfico. Cali no es un caso fácil de resolver, pero será más difícil si quienes mandan no se articulan y dejan de lado sus diferencias políticas.",https://twitter.com/sergio_fajardo,Sergio Fajardo,https://twitter.com/sergio_fajardo/status/1388205194731827203,2021-09-06T20:03:09.574Z,https://twitter.com/search?q=from%3Asergio_fajardo%20since%3A2021-04-01%20until%3A2021-06-30&src=typed_query&f=live
Tue May 04 15:13:51 +0000 2021,25185308,sergio_fajardo,"Presidente vaya a Cali con sus ministros y escuche el dolor y la indignación. Ordene parar la violencia. Convoque alcaldes y gobernadora, la arquidiócesis, organizaciones. Haga un diálogo público, televisado. Lidere y convoque a todo el país. Presidente, todos podemos aportar.",https://twitter.com/sergio_fajardo,Sergio Fajardo,https://twitter.com/sergio_fajardo/status/1389599158542213124,2021-09-06T20:03:09.574Z,https://twitter.com/search?q=from%3Asergio_fajardo%20since%3A2021-04-01%20until%3A2021-06-30&src=typed_query&f=live
