Tweet,Sentiment Score,Sentiment Magnitude
"La invitación fue a la comisión primera, de donde soy miembro. ", 0.20000000298023224 , 0.20000000298023224
¿Hace un año? , 0.10000000149011612 , 0.10000000149011612
"Yo no digo mentiras, senador. ", -0.30000001192092896 , 0.30000001192092896
Terroristas urbanos instalaron un cable entre dos postes para decapitar policías cuando pasen con las motos. , 0.30000001192092896 , 0.30000001192092896
"Hoy, asesinaron a un civil. ", 0.0 , 0.0
¡Urge autoridad! , 0.800000011920929 , 0.800000011920929
#CityNoticias | El Distrito pide avanzar en la investigación sobre los heridos en los enfrentamientos que se han presentado en Bogotá en los últimos días. , 0.20000000298023224 , 0.20000000298023224
La alcaldesa Claudia López arremetió nuevamente contra la Policía. , 0.10000000149011612 , 0.10000000149011612
Más detalles acá ⬇️ ,,
Atentos a lo que viene con @Alvisepf ! , 0.0 , 0.0
#España #Colombia ,,
¡Excelente! , 0.8999999761581421 , 0.8999999761581421
“Bogotá no dejará imponer el caos”: Claudia López sobre recientes enfrentamientos ,,
Todo mi cariño y apoyo a los hombres y mujeres que integran al ESMAD. , 0.4000000059604645 , 0.4000000059604645
Son los verdaderos héroes! , 0.8999999761581421 , 0.8999999761581421
#SoyCabal | Estaré en el lugar que Dios y los colombianos decidan. , 0.30000001192092896 , 0.30000001192092896
"#SoyCabal | “La ‘derechita cobarde’ es la que ha llevado a los países a su destrucción porque pierde la identidad con una base conservadora, firme, que quiere a sus instituciones” ",,
Acabaron con el Portal de Suba. , 0.0 , 0.0
Miserables @GustavoBolivar @AdrianaLucia @petrogustavo y demás payasos ,,
"En eso quedó la paz de Santos: objetivo, matar al Presidente. ", 0.0 , 0.0
Por eso no se puede negociar con los bárbaros. , -0.30000001192092896 , 0.30000001192092896
Hay que someterlos. , 0.0 , 0.0
Vándalos generando caos en la carrera 104 con calle 145 #Bogotá ,,
El Estado de Florida acaba de aprobar una ley en la que todas las escuelas deberán enseñar los horrores del comunismo. , -0.30000001192092896 , 0.30000001192092896
"Será una materia de educación cívica en donde disertaran personas que han huido de estos regímenes, para contar su experiencia a los jóvenes. ", 0.4000000059604645 , 0.4000000059604645
¡Excelente noticia! , 0.8999999761581421 , 0.8999999761581421
Destrozan los servicios de trasporte público por la anarquía violenta financiada por el narcotráfico y estos funcionarios salen a señalar a la fuerza pública. , -0.10000000149011612 , 0.10000000149011612
¡Uy parce! , 0.4000000059604645 , 0.4000000059604645
Aprovechemos mientras nos tiramos el luch pa’ embadurnarnos de pintura y “demostrar” en redes que somos víctimas de la Fuerza Pública. , 0.0 , 0.0
"Vivanco, Petro, Bolívar y todo ese combito de caudillos se encargan del resto. ", 0.5 , 0.5
¡Va pa’ esa! , 0.6000000238418579 , 0.6000000238418579
#AtenciónComunidadET | Helicóptero en el que se desplazaba el presidente Duque fue baleado ➡️  ,,
"En el portal Suba, terroristas urbanos destruyeron todo a su paso. ", 0.0 , 0.0
Afectan a más de 600 mil personas que hacen uso de este servicio a diario. , 0.0 , 0.0
Dónde está el secretario de seguridad?? , 0.20000000298023224 , 0.20000000298023224
Los gestores no hacen nada? , -0.10000000149011612 , 0.10000000149011612
Quién responde por Bogotá? , 0.20000000298023224 , 0.20000000298023224
¡Qué desocupados! , 0.10000000149011612 , 0.10000000149011612
"Plata para pintura si hay, y tiempo para destruir la ciudad. ", 0.0 , 0.0
¿Dónde vive? , 0.10000000149011612 , 0.10000000149011612
Cargo del Habeas Data firmado por Domingo García Belaunde. , 0.10000000149011612 , 0.10000000149011612
Es el derecho de millones de peruanos acceder a la lista de electores por mesa de sufragio para verificar todas las irregularidades que hemos denunciado ante el JNE. , 0.30000001192092896 , 0.30000001192092896
"🚨 A través de un comunicado publicado en redes sociales, la primera línea de Suba informó que atacará a buses de TransMilenio con sus pasajeros porque, supuestamente, están colaborando con la Policía 👉  ",,
"Qué horror caer en las fauces de los verdes ""sandía"", que usan las víctimas como trofeo de guerra en su narrativa pervertida contra la policía. ", -0.30000001192092896 , 0.30000001192092896
Todos estos indignos deben renunciar a sus escoltas policiales. , -0.20000000298023224 , 0.20000000298023224
Sinverguenzas. , 0.20000000298023224 , 0.20000000298023224
"No es resistencia, es terrorismo",,
"El @SenadoGovCo aprobó PL 391/2021 Senado, 044/2019 Cámara- acumulado con PL 213/2019 Cámara: “Por medio de la se promueve el abastecimiento, continuidad, confiabilidad y cobertura del gas combustible en el país” proyecto que presentamos con @EdwBallesteros ",,
Los captores pedían $700 millones por su liberación. , 0.0 , 0.0
En el operativo fue capturado un hombre que tenía medida de detención domiciliaria. , 0.20000000298023224 , 0.20000000298023224
TOUR DE LA CORRUPCIÓN SANTA MARTA #2 #MafiaCaicedista ,,
"Ahí si no hablan los ""Vivancos"", ni los ""temblores"", ni los sicarios morales de ""Cuestión Pública"". ", 0.0 , 0.0
"Éste jóven iba de civil, fue secuestrado, torturado y asesinado por ""manifestantes pacíficos"". ", 0.0 , 0.0
@cidh @MisionONUCol @A_OrdonezM @JMVivancoHRW @TembloresOng @cuestion_p,,
"#SoyCabal | Llevo tres años esperando que los entes de control me entreguen la investigación sobre qué hizo el #CRIC con los $50 mil millones que les dio el Gobierno de Juan Manuel Santos, a través del Ministro Iragorri y Cristo ¿Dónde está esa plata? ", 0.0 , 0.0
Guillen quiere hacernos creer que alguien es tan idiota que pone su propio vehículo para usarlo de carro bomba y pasar a ser el primer incriminado. , -0.699999988079071 , 0.699999988079071
#Denuncia : nueva maniobra d Uribista Presidente Comisión 2 d @CamaraColombia Juan David Velez: no ha querido citar para anunciar Proyecto d Ratificación d Acuerdo d Escazú y pueda votarse el 20 junio último día de la legislatura. , -0.20000000298023224 , 0.20000000298023224
Quieren hundirlo! , 0.30000001192092896 , 0.30000001192092896
Comerciantes y propietarios de la Avenida 68 exigen respuestas frente a la expropiación de la Alcaldía de Bogotá a sus predios - El Expediente ,,
"Toda una expresión ""pacífica"". ", 0.20000000298023224 , 0.20000000298023224
Columna de Opinión: Las mentiras de… “el señor” | CONtexto ganadero | Noticias principales sobre ganadería y agricultura en Colombia ,,
La izquierda le echa en cara no haberse referido explícitamente al colectivo LGTBI. , -0.20000000298023224 , 0.20000000298023224
Ayuso: ,,
Nuestra policía merece respeto y respaldo para actuar ante estas canalladas ,,
"Vio, las ONG de garaje compartiendo fake news o noticias viejas como actuales. ", 0.20000000298023224 , 0.20000000298023224
El mismo alcalde de Palmira les hace la rectificación. , 0.20000000298023224 , 0.20000000298023224
"Esas son las fuentes que consultan algunos, por eso viven llenos de odio y desinformados, consumen mentiras ¡NO MÁS! ", -0.5 , 0.5
👇🏽,,
"Aterrador: tres disparos de arma de fuego, 30 puñaladas y quemaduras con ácido: el reporte forense de patrullero asesinado en Cali ",,
"Pecado Social: usar la sotana para engañar feligreses, promover secuestro de civiles y policiales, impedir el acceso a urgencias médicas, bloquear la llegada de elementos vitales de supervivencia, de oxígeno, de comida. ", -0.10000000149011612 , 0.10000000149011612
Sin olvidar aquella práctica horrenda de la pederastia. , 0.699999988079071 , 0.699999988079071
Todo lo de los mamertos es falso. , -0.30000001192092896 , 0.30000001192092896
"#SoyCabal | Hoy, el Congreso de la República aprobó el Proyecto de Ley que busca promover el abastecimiento, continuidad, confiabilidad y cobertura de gas combustible en Colombia, de autoría nuestra junto al Representante @EdwBallesteros. ", 0.10000000149011612 , 0.10000000149011612
¡Oficialmente será Ley de la República! , 0.20000000298023224 , 0.20000000298023224
Centro Democrático pedirá objetar la “legalización” del microtráfico - El Bogotano ,,
"Están ubicados en Pereira, con cientos de miles de seguidores falsos. ", -0.10000000149011612 , 0.10000000149011612
Son defensores de la barbarie. , 0.10000000149011612 , 0.10000000149011612
#DATO Varias de las cuentas que están trinando hoy con el numeral #MiAlcaldeEsDanielQuintero son cuentas falsas. , -0.30000001192092896 , 0.30000001192092896
"No tienen nombre preciso, ni fotografía de ninguna persona y con pocos seguidores. ", -0.30000001192092896 , 0.30000001192092896
Voy con hilo corto:,,
¿Se reformó la administración de justicia? , 0.0 , 0.0
- El Expediente ,,
Profesores que no vayan a clases presenciales no recibirán sueldo - El Bogotano ,,
El diálogo fue la excusa para prolongar la destrucción de la ciudad. , -0.10000000149011612 , 0.10000000149011612
Ya es tarde. , 0.0 , 0.0
"Los afectados deben demandar a la alcaldía para que los reparen, y denunciar disciplinaria y penalmente al alcalde que legalizó la barbarie. ", -0.10000000149011612 , 0.10000000149011612
Más claro imposible. , -0.20000000298023224 , 0.20000000298023224
No hay comunista que no sea corrupto. , 0.30000001192092896 , 0.30000001192092896
Es su esencia. , 0.6000000238418579 , 0.6000000238418579
Los 50 escándalos de Daniel Quintero en un año de alcaldía – La Linterna Azul ,,
"""Agotado el Diálogo, cualquiera que intente bloquear los 4 puntos restantes de los 25 que se han levantado, recibirá sanción ejemplar como capturas y judicializacion"": Carlos Soler secretario de @SeguridadCali ",,
"Definición de “Pecado Social”: tumbar la olla comunitaria cuando, según las cifras oficiales, hay más de 20 millones de pobres en Colombia. ", 0.0 , 0.0
Pasó en #Cali. , 0.10000000149011612 , 0.10000000149011612
La sesión conjunta de comisiones 2das de Senado y Cámara debe ser citada por su Presidente respectivo; no por quien preside la comisión 2da de Cámara. , 0.10000000149011612 , 0.10000000149011612
No engañe y no confunda. , 0.10000000149011612 , 0.10000000149011612
"Aunque ésa es la especialidad de los verdes sandía, verdes por fuera, rojos por dentro. ", 0.30000001192092896 , 0.30000001192092896
Lo increíble es que no tengan juez. , 0.8999999761581421 , 0.8999999761581421
Son anarquistas e impunes. , 0.10000000149011612 , 0.10000000149011612
"#InformaLaComunidad En Cúcuta hace pocos minutos, se registró una fuerte explosión en inmediaciones del Cantón Militar San Jorge, sector El Pórtico. ", 0.30000001192092896 , 0.30000001192092896
Primeras versiones indican que sería un carro bomba. , 0.10000000149011612 , 0.10000000149011612
#NoAEscazú | ¡Para los que aún dudan! , 0.699999988079071 , 0.699999988079071
"El artículo 2 le abre las puertas a un nuevo mecanismo de extorsión ‘legal’, en donde CUALQUIER persona natural o jurídica u ONG extranjera, puede frenar con la excusa de “afectación al medio ambiente” todo tipo de actividad económica. ", 0.0 , 0.0
¡Inaudito! , 0.5 , 0.5
"Escuche la verdad verdadera, de boca de doña Thelma Marcos, una indígena ixil que junto a su familia fue víctima de la organización terrorista EGP en 1982. ", -0.20000000298023224 , 0.20000000298023224
Una prueba más de que en Guatemala no hubo genocidio. , 0.10000000149011612 , 0.10000000149011612
“Era el sacerdote el mero cabezón. , 0.30000001192092896 , 0.30000001192092896
Él encabezaba la guerrilla pues.” , 0.10000000149011612 , 0.10000000149011612
"Para que sigan ""dialogando"". ", 0.20000000298023224 , 0.20000000298023224
Se va Bensouda: sale la Fiscal de la CPI sin resolver denuncias en Venezuela - El Bogotano ,,
“El problema es la pobreza. , -0.10000000149011612 , 0.10000000149011612
Nadie murió nunca de desigualdad.” , 0.5 , 0.5
Más logros de los promotores del paro. , 0.5 , 0.5
No les importa dejar a tanta ciudadanía afectada #JudicializaciónYa #ColombiaSeRespeta ,,
"Dentro de las iniciativas por la igualdad, ahora padre y madre podrán llegar a un acuerdo para decidir cual de los apellidos va primero. ", 0.0 , 0.0
Acabó con la ciudad. , 0.6000000238418579 , 0.6000000238418579
No podía esperarse nada diferente. , 0.20000000298023224 , 0.20000000298023224
En pleno siglo XXI convirtió Cali en un campo de guerra y pobreza. , -0.30000001192092896 , 0.30000001192092896
Aprendió bien la lección en Cuba. , 0.699999988079071 , 0.699999988079071
EL SUFRIMIENTO DEL POLICÍA SECUESTRADO POR TERRORISTAS URBANOS EN CALI ,,
"Estamos en vivo en la cumbre #ECREuroLat, en defensa de la libertad y la democracia frente al narcosocialismo en Iberoamérica. ", 0.10000000149011612 , 0.10000000149011612
"🗣️ junto a @ivanedlm, @JMilei, @hermanntertsch y más. ", 0.4000000059604645 , 0.4000000059604645
Cumbre EuroLat 2021 | Miercoles 16 de Junio  vía @YouTube,,
"¿Qué dicen las organizaciones ""humanitarias? ", 0.0 , 0.0
Nada. , -0.30000001192092896 , 0.30000001192092896
"Bloquear en twitter es un derecho precioso, solo en twitter",,
"Los elenos necesitan ""que suene"". ", 0.0 , 0.0
Psicopatas.. , 0.10000000149011612 , 0.10000000149011612
Eso no es novedad. , -0.30000001192092896 , 0.30000001192092896
"Ya existe y los ""progres"" hacen show de ""igualdad de género"". ", 0.10000000149011612 , 0.10000000149011612
#Urgente Derly Pastrana está muy grave y se necesita sangre tipo O, para salvarla. , -0.4000000059604645 
"Para donar, hay que acercarse al Hospital Hernando Moncaleano de Neiva. ", 0.10000000149011612 , 0.10000000149011612
Línea de contacto: 8715907 ext.1138 y 1236. , 0.10000000149011612 , 0.10000000149011612
Es increíble que el Comité del Paro esté organizando un concierto para el 20 de junio. , 0.5 , 0.5
No les basta los 5000 fallecidos por las aglomeraciones que han propiciado. , -0.10000000149011612 , 0.10000000149011612
#RespetenLaVida,,
Estos demonios los exalta la @UNESCO_es una vergüenza mundial. , -0.4000000059604645 , 0.4000000059604645
"Atentos: A esta hora las hipótesis sobre los responsables del atentado con carro bomba en Cúcuta hablan de la posibilidad de que haya sido el ELN o las disidencias de Farc, Frente 33, que delinque en la zona del Catatumbo. ", 0.20000000298023224 , 0.20000000298023224
Vía @UltimaHoraBLU @BluRadioCo,,
El tributo hay que rendírselo a los asesinados por el Che Guevara... , 0.0 , 0.0
no a este criminal hijo del infierno. , -0.4000000059604645 , 0.4000000059604645
"Hoy a las 11:00 am estaré compartiendo en un panel de #EuroLat , donde Hablaremos sobre el panorama que se muestra para América Latina, en el que el futuro político de Colombia juega un papel estratégico. ", 0.5 , 0.5
Sigan la transmisión en:  ,,
¿Y la alcaldesa? , 0.30000001192092896 , 0.30000001192092896
El activismo marxista espanta feligreses. , 0.20000000298023224 , 0.20000000298023224
Secuestraron a un Policía en Cali que estaba de civil y de descanso. , 0.20000000298023224 , 0.20000000298023224
"Si esto no son delincuentes, ¿entonces que son? ", -0.20000000298023224 , 0.20000000298023224
@JorgeIvanOspina asistiendo a los lugares de manifestaciones y a la disque inauguración de un objeto y a su vez están secuestrando. , 0.20000000298023224 , 0.20000000298023224
No siga siendo complice de esto ,,
Me preguntan cómo puede ser corrupto @arzobispodecali: 1. , 0.0 , 0.0
Promueve ideología destructora del Marxismo 2. , -0.10000000149011612 , 0.10000000149011612
Ataca ferozmente instituciones si van en contra de su ideología 3. , 0.0 , 0.0
Es activista político Recomendado: ,,
"#ColombiaNoOlvida | Un día como hoy, 18 de junio de 2007, terroristas de las FARC asesinaron a once de los doce diputados del Valle del Cauca que fueron secuestrados en la sede de la Asamblea del Departamento. ", 0.10000000149011612 , 0.10000000149011612
Siempre es igual en todas partes donde el comunismo hace presencia. , 0.4000000059604645 , 0.4000000059604645
"Mitos y leyendas, curas marxistas... ", 0.5 , 0.5
en fin. , 0.10000000149011612 , 0.10000000149011612
Todo invertido. , 0.6000000238418579 , 0.6000000238418579
¡Ya están las planillas Medellín! , 0.699999988079071 , 0.699999988079071
A firmar todos para sacar ese alcalde ,,
Opinión | Libertad y orden ,,
"¿Ya averiguó el Consejero para la seguridad Rafael Guarin, el origen de la armas de los sicarios de las farc que asesinaron al cantante en Cali? ", 0.20000000298023224 , 0.20000000298023224
Un fusil Colt AR-15 calibre 5.56 y una pistola Glock calibre 9mm. , 0.10000000149011612 , 0.10000000149011612
¡Y pretende que los ciudadanos se defiendan con caucheras!. , -0.10000000149011612 , 0.10000000149011612
Para enriquecerse. , 0.4000000059604645 , 0.4000000059604645
"Por eso creo la empresa ""Bance"". ", 0.0 , 0.0
"Con un incremento patrimonial de un año a otro, exponencial. ", 0.30000001192092896 , 0.30000001192092896
"ÚLTIMA HORA: @PoliciaColombia , impide ENTIERRO ANCESTRAL de líder de la Minga Indígena. ", -0.30000001192092896 , 0.30000001192092896
Faltó desmovilizar a Santos... , 0.30000001192092896 , 0.30000001192092896
URGENTE Dos buses con jóvenes de la primera línea que acompañaron hoy el acto de inauguración del monumento de Puerto Resistencia en Cali fueron arbitrariamente detenidos por la policia en este momento. , 0.20000000298023224 , 0.20000000298023224
Los jóvenes temen por su vida. , 0.6000000238418579 , 0.6000000238418579
@hrw_espanol @nytimeses @Tercer_Canal ,,
"#Columna | Los tres componentes del fraude en el Perú Espero que los peruanos no se dejen presionar por declaraciones, ni por chantajes de nadie; y que no se proclame al ganador hasta tanto no se haya analizado hasta la última acta. ", -0.20000000298023224 , 0.20000000298023224
"No elegimos un gobierno para que desarmara a los ciudadanos que portan armas legales, porque temen por sus vidas; no aceptamos prohibiciones absurdas mientras las armas ilegales matan civiles, soldados y policías. ", -0.4000000059604645 , 0.4000000059604645
Los comunistas detestan la democracia pero la usan para llegar al poder y atornillarse al mando. , 0.0 , 0.0
El cinismo sin límites del ex ministro de Defensa de Uribe que llamaba narco terroristas a las FARC para después entregarles el país. , 0.10000000149011612 , 0.10000000149011612
"Quien desmovilizó a las FARC fue Uribe, Santos les permitió re armarse. ", 0.4000000059604645 , 0.4000000059604645
¿O sea que toda la farsa de @HOLLMANMORRIS era para encubrir un secuestro? , -0.10000000149011612 , 0.10000000149011612
Funcionarios públicos y miembros de DD.HH. , 0.20000000298023224 , 0.20000000298023224
estarían al servicio del crimen | Judicial | Caracol Radio ,,
Sígueme también en mi canal oficial de Telegram ,,
"“Si a él (Santos) no le gustaba la Seguridad Democrática, ¿por qué me pidió que lo nombrara Ministro de Defensa?” ", 0.0 , 0.0
Uribe #LaVerdadDeUribe,,
"Patrullero Padilla, víctima de terroristas urbanos que llaman ""protesta"" a sus crímenes. ", 0.0 , 0.0
Le dieron 27 puñaladas. , 0.0 , 0.0
"Aterrador escuchar como moribundo, corre a refugiarse en una vivienda y allá lo buscan y lo sacan a la calle para que muera. ", 0.30000001192092896 , 0.30000001192092896
Cuatro días en UCI y lesiones graves. , 0.0 , 0.0
¿Quién pago los buses? , 0.4000000059604645 , 0.4000000059604645
¿Cuánto dinero entregaron para seguir enviando la gente a la muerte en plena pandemia? , 0.0 , 0.0
"Los únicos que tienen miedo son los buenos, hoy arrinconados por los bárbaros que ustedes dirigen. ", 0.10000000149011612 , 0.10000000149011612
¡Qué tal! , 0.6000000238418579 , 0.6000000238418579
"¿Estas son las maracas y panderetas que les compró Gustavo Bolívar a los de la primera línea criminal para que canten ""Tutaina"" mientras supuestamente defienden el país? ", -0.30000001192092896 , 0.30000001192092896
¿Cuidar la vida? , 0.0 , 0.0
"O permitir a los indígenas ingresar violentamente a los barrios de Cali a agredir a sus pobladores, facilitar el uso de una universidad pública como campo de guerra, legalizar las conductas criminales a través de los puntos de ""resistencia"". ", -0.10000000149011612 , 0.10000000149011612
Cínico. , 0.20000000298023224 , 0.20000000298023224
"En Cali sujetos armados secuestran un bus, con 9 personas a bordo. ", 0.0 , 0.0
La Policía posteriormente intervino y liberó a los pasajeros  @pedrosoto785 @Iadossa @ibmtw2010 @pasionpais @JusticiaEsPaz35 @cecollm @AliRestrepo @ricardoansal @duvanedo @CarrillonavasG ,,
Presidencia presentó a MinDefensa un proyecto para prohibir la venta y porte de armas traumáticas ,,
"Cosas de la vida: Juan Manuel Santos en su libro “Jaque al terror”, catalogó a las Farc como terroristas y elogió la seguridad democrática. ", 0.0 , 0.0
"En su discurso en la comisión de la verdad, Juan Manuel Santos contradice a Juan Manuel Santos. ", 0.20000000298023224 , 0.20000000298023224
¿A cuál Juan Manuel Santos le creemos? , 0.0 , 0.0
"Señores ⁦@mincultura⁩ : si van a remover estatuas que son patrimonio histórico, les recomiendo quitar ésta, que representa la deslealtad, la mentira y el ""apaciguamiento"" frente al terrorismo. ", -0.20000000298023224 , 0.20000000298023224
"Me divierte ver a reinsertados dar cátedra de "" justicia en el uso de la tierra"". ", 0.800000011920929 , 0.800000011920929
"Puedo asegurar que el grupo al que usted perteneció lleno de terror a los agricultores y campesinos del Cesar y Santander, entre otros. ", 0.20000000298023224 , 0.20000000298023224
Frágil la memoria del que olvida su propia historia... , 0.30000001192092896 , 0.30000001192092896
Es tan cínico... , 0.4000000059604645 , 0.4000000059604645
@jarizabaletaf Cuidar la vida. , 0.0 , 0.0
A los extremos les es imposible entenderlo. , -0.30000001192092896 , 0.30000001192092896
Guardar la vida es el mejor ejemplo de autoridad existente. , 0.699999988079071 , 0.699999988079071
Y definitivamente no estamos de espaldas a proteger la vida. , -0.4000000059604645 , 0.4000000059604645
Pero todos los dias sale un agitador a la calle,,
Desafiantes los criminales. , -0.30000001192092896 , 0.30000001192092896
Terminará Cali en una confrontación por cuenta de no suspender ese alcalde delincuente. , -0.10000000149011612 , 0.10000000149011612
El cura De Roux es quien debe comparecer ante la Comisión de la Verdad. , 0.5 , 0.5
"Él y otros sacerdotes marxistas Jesuitas, claretianos y ""redentoristas"" afines a la teología de la liberación. ", 0.20000000298023224 , 0.20000000298023224
¿Por qué Cabal y Lafaurie quieren hundir el proyecto que busca justicia en el uso de la tierra en el campo? , 0.0 , 0.0
Aquí @AngelicaLozanoC y @JuanitaGoe nos explican. , 0.20000000298023224 , 0.20000000298023224
"#EspecialidadAgraria, el ÚNICO proyecto que implementa el proceso de paz que está a punto de ser aprobado. ", 0.30000001192092896 , 0.30000001192092896
#Agéndenlo. , 0.10000000149011612 , 0.10000000149011612
"Acaban de retener al Teniente Castro Ruales Jhon Fredy, en un retén ilegal, lo identifican y lo conducen hasta Pto Rellena, se encontraba Franco el día de hoy, está secuestrado. ", -0.10000000149011612 , 0.10000000149011612
Se solicita en este momento al Ministerio público su intervención para que sea liberado sano y salvo. , 0.30000001192092896 , 0.30000001192092896
"#Atención Esposa del Policía Ángel De Jesús Campos, confirma trato inhumano cuando llegó al @HUSantander “lo trataron mal, lo trataron de cerdo”. ", -0.10000000149011612 , 0.10000000149011612
Ojalá que nunca se vuelva a presentar discriminación contra nadie en centro médico. , -0.4000000059604645 , 0.4000000059604645
@GobdeSantander @PGN_COL @PoliciaBmanga ,,
Eso no es gratis. , -0.30000001192092896 , 0.30000001192092896
Vienen fletados por alguien... , 0.10000000149011612 , 0.10000000149011612
¿ya se pronunció la @FLIP_org ? , 0.10000000149011612 , 0.10000000149011612
"Como exvicepresidente de Colombia, elegido popularmente en el 2010 junto con Juan Manuel Santos como presidente, manifiesto públicamente, que sin el respaldo del presidente Álvaro Uribe Vélez en ese momento, no hubiéramos logrado esa victoria democrática. ", -0.10000000149011612 , 0.10000000149011612
"Juanita Goebertus es cuota de Sergio Jaramillo, ""alto"" consejero de paz de Santos y negociador -con ella- en la Habana. ", 0.30000001192092896 , 0.30000001192092896
"Juanita se opone a reformar la ley de restitución de tierras, que deja a campesinos en la miseria. ", 0.0 , 0.0
@PGN_COL,,
"El desgarrador relato de Ángel Campos, patrullero a quien intentaron quemar vivo durante el paro ",,
Congresista solicita que no haya participación de Fecode como jurado en elecciones - Políticos ,,
Se estaba demorando Juan Manuel Santos en visitar la peluquería del Cura @FranciscoDeRoux. , -0.10000000149011612 , 0.10000000149011612
"Lástima que lo que se diga en la comisión no tenga fuerza jurídica: no se sanciona la mentira, y por tanto, poco interesa la verdad. ", -0.6000000238418579 , 0.6000000238418579
Toda una pantomima. , 0.20000000298023224 , 0.20000000298023224
Difícil saber cuál de los dos es peor. , -0.5 , 0.5
Farsante. , 0.20000000298023224 , 0.20000000298023224
"#Columna | El Foro de Sao Paulo organizó el fraude en Perú Quiero denunciar formalmente que el Foro de Sao Paulo cuenta con un equipo itinerante, experto en cometer fraude, que viaja a nuestras naciones cada vez que hay una elección. ", -0.20000000298023224 , 0.20000000298023224
"Le recomendaría al colegio San Pedro Claver de Bucaramanga, pedir explicación a la profesora que pone estás actividades a niños de 4 primaria ",,
Qué desgracia,,
"""Me queda el remordimiento de que durante mi Ministerio muchas, muchísimas madres perdieron a sus hijos por esta práctica tan despiadada. ", -0.5 , 0.5
