Tweet,Sentiment Score,Sentiment Magnitude
Los indígenas con camionetas de la UNP pagadas con nuestros impuestos. , 0.30000001192092896 , 0.30000001192092896
Toda una estrategia de guerra urbana. , 0.4000000059604645 , 0.4000000059604645
¿Y el gobierno dialogando con los elenos? , 0.0 , 0.0
Indígenas armados amedrentando a la población aterrorizada. , -0.10000000149011612 , 0.10000000149011612
⁦@MisionONUCol⁩ ¿ustedes mudos? , 0.0 , 0.0
Se ríen los terroristas que tienen tomado a Cali. , 0.0 , 0.0
"Sigan ""dialogando"". ", 0.6000000238418579 , 0.6000000238418579
Así lleva el régimen chavista 23 años.... y cada día más fuerte. , 0.30000001192092896 , 0.30000001192092896
Valdría la pena contratar a un especialista en perfiles psiquiátricos. , 0.699999988079071 , 0.699999988079071
Son iguales a los zombies. , 0.10000000149011612 , 0.10000000149011612
"Mauricio Alvarado, fotógrafo de El Espectador, participó tomando fotos en el circo de desadaptados que gritaron y tiñeron de rojo la fuente del edificio de Semana, en un acto violento. ", 0.30000001192092896 , 0.30000001192092896
Las feministas lo volvieron a hacer. , 0.4000000059604645 , 0.4000000059604645
@ymarce7312 @MamaPerruna_ @marce84_ @NoSoyLaChio ,,
Por favor ahora que no nombren a Ceballos. , -0.20000000298023224 , 0.20000000298023224
Nosotros no elegimos dialogar con narcoterroristas. , -0.20000000298023224 , 0.20000000298023224
Atención | Se va del cargo la canciller Claudia Blum ,,
¡Bien por la sociedad civil! , 0.5 , 0.5
Ante la ausencia de autoridad del Estado. , 0.0 , 0.0
#LiberenACali ,,
Indígenas criminales golpean con piedras y machetes a un ciudadano. , -0.20000000298023224 , 0.20000000298023224
⁦@FiscaliaCol⁩ ⁦@PGN_COL⁩ ⁦@DefensoriaCol⁩ ⁦@MisionONUCol⁩ ⁦@CIDH⁩ ,,
"La minga ""pacífica"". ", 0.10000000149011612 , 0.10000000149011612
⁦@ONUHumanRights⁩ ¿Tampoco habla la señora Patricia? , 0.0 , 0.0
Francia prohíbe el uso de lenguaje inclusivo en los colegios ,,
"¿Qué dirán los ""animalistas""? ", -0.20000000298023224 , 0.20000000298023224
Columna de Opinión: Guerra contra Colombia| CONtexto ganadero | Noticias principales sobre ganadería y agricultura en Colombia ,,
"La mayoría de los colombianos, amamos y respetamos a nuestra Fuerza Pública. ", 0.10000000149011612 , 0.10000000149011612
"Aunque los violentos intenten invertir esa realidad, no lo van a lograr! ", -0.10000000149011612 , 0.10000000149011612
Están en nuestro corazón ❤ ,,
"Vaya, vaya. ", 0.4000000059604645 , 0.4000000059604645
La mejor muestra de lo que es un defensor de izquierdos humanos. , 0.8999999761581421 , 0.8999999761581421
"Defiende a un asesino que clavó 37 puñaladas en el pecho y la cabeza al Capitán Solano, quien pronto recibiría su doctorado en Educación. ", 0.0 , 0.0
Así es como inicia el fin de la civilización. , 0.10000000149011612 , 0.10000000149011612
¡Así es! , 0.30000001192092896 , 0.30000001192092896
Los que construimos patria somos más. , 0.20000000298023224 , 0.20000000298023224
"🚨 ÚLTIMAHORA: Terroristas asesinaron a dos patrulleros de la Policía en Tibú, Norte de Santander ",,
"Envío este audio al despreciable Vivanco ⁦@JMVivancoHRW⁩ para que escuche el relato que hace el fiscal del caso del Capitan Solano, asesinado salvajemente a piedra, patadas y cuchillo a manos de los ""jóvenes con derecho a la protesta"". ", 0.0 , 0.0
@ONU_es @ONUHumanRights @MisionONUCol ¿alguno se digna a dar el pésame a la viuda? , 0.0 , 0.0
#Atención | Un video aficionado se convirtió en la clave de las autoridades para imputar como responsables del asesinato del director de la Sijín en Soacha a tres hombres capturados recientemente ►  ,,
Igualito al demente que echaron del Nogal... , 0.20000000298023224 , 0.20000000298023224
"Es el ""derecho a la protesta"". ", 0.20000000298023224 , 0.20000000298023224
Para el Allendista @JMVivancoHRW y sus amigos que jamás han resuelto ningún conflicto @ONU_es @onucolombia @mbachelet,,
Arrestan a Colombiano en Londres. , 0.5 , 0.5
"Los ""pacifistas"" hirieron a un agente del ESMAD con arma de fuego en el Portal Las Américas. ", 0.10000000149011612 , 0.10000000149011612
"La meta es asesinar a integrantes de la Fuerza Pública, y presentar internacionalmente que son unos niños buenos sometidos por la fuerza legítima. ", 0.5 , 0.5
Qué horror la maldad de este país. , -0.5 , 0.5
Pero el Comité del Paro quiere seguridad alimentaria. , 0.20000000298023224 , 0.20000000298023224
La fuerza del Estado es legítima. , 0.0 , 0.0
La violencia de los vándalos y terroristas es ilegítima. , -0.10000000149011612 , 0.10000000149011612
@DiegoASantos La prueba ,,
Peleaaaaaa 🍿🍿 ,,
Los amo. , 0.800000011920929 , 0.800000011920929
El civismo que siempre ha caracterizado a los caleños. , 0.4000000059604645 , 0.4000000059604645
Por la paz. , 0.699999988079071 , 0.699999988079071
Sin bloqueos. , 0.6000000238418579 , 0.6000000238418579
Sin vandalismo. , 0.4000000059604645 , 0.4000000059604645
Sin terrorismo. , 0.6000000238418579 , 0.6000000238418579
#ValleLibre ,,
¡No les importa la vida! , 0.20000000298023224 , 0.20000000298023224
"Intentan quemar a nuestros policías en #Bogotá, nuestra Minina la gatica que acompañaba a los compañeros en un CAI en #Popayan fue vilmente golpeada y perdío la vida por los vándalos,”Te extrañaremos Minina”. ", 0.0 , 0.0
#TodosConColombia ,,
Deben estar muy tristes los dos con la captura del eleno en Cali preparando una granada para culpar al Esmad. , -0.20000000298023224 , 0.20000000298023224
"Estarían ambos regocijándose si detona el artefacto entre la multitud, como hienas con la carroña. ", 0.10000000149011612 , 0.10000000149011612
Aquí están dándose diente. , 0.10000000149011612 , 0.10000000149011612
"Paro nacional: denuncian exceso de fuerza por parte del Esmad en Gachancipá, Cundinamarca. ", 0.0 , 0.0
"Esta es la barbarie que los tales organismos benefactores de crimínales como la ONU o Vivanco -el títere de Soros-, no ven. ", 0.0 , 0.0
Desgraciados. , 0.20000000298023224 , 0.20000000298023224
"Luego gritan ""nos están matando"", cuando se dan bala entre ellos. ", -0.10000000149011612 , 0.10000000149011612
Preocupación nacional por el desabastecimiento a causa de los bloqueos. , 0.0 , 0.0
"La escasez de ciertos productos se siente en Bogotá, Cali, Boyacá y los Llanos Orientales. ", -0.20000000298023224 , 0.20000000298023224
Esta es la situación 👉  ,,
¿Por qué no me extraña que Alirio Uribe Muñoz sea el defensor de uno de los homicidas del capitán Jesús Solano? , 0.0 , 0.0
Cómo siempre de lado incorrecto de la historia. , -0.20000000298023224 , 0.20000000298023224
#FakeNews | Esta publicación en Facebook sobre un supuesto ataque contra jóvenes en Cali se trata de una #NoticiaFalsa. , -0.10000000149011612 , 0.10000000149011612
El hecho corresponde realmente a imágenes tomadas en Venezuela el 1 de abril con cuerpos de víctimas del Covid. , 0.5 , 0.5
#RompaLaCadena #ColombiaEsMiVerdad ,,
"Si fuera aquí gritarían ""nos están matando"". ", -0.20000000298023224 , 0.20000000298023224
Allá solo chillan y no queman policías vivos.... , -0.10000000149011612 , 0.10000000149011612
"ni les meten 37 puñaladas, ante la indiferencia de ""les estudiantes"" y los organismos de izquierdos humanos (Perdón por la ofensa: Les Organismes de izquierdes Humanes). ", 0.0 , 0.0
"Capturan a alias Lerma, cabecilla del ELN que estaría implicado en vandalismo en Cali ",,
¿Venezuela? , 0.10000000149011612 , 0.10000000149011612
No. , -0.6000000238418579 , 0.6000000238418579
Es Cali. , 0.4000000059604645 , 0.4000000059604645
Haters gonna hate ,,
"Perdieron las elecciones y ahora vienen solapados a ""contribuir"" al diálogo. ", -0.30000001192092896 , 0.30000001192092896
"Que no se nos olvide que desconocieron el plebiscito, premiaron violadores de niños con curules y nos dejaron el país lleno de coca. ", 0.10000000149011612 , 0.10000000149011612
También son responsables. , 0.8999999761581421 , 0.8999999761581421
"#Atención, sale a la luz quién recibe el informe de las marchas y da órdenes para permitir el paso en bloqueos. ", 0.30000001192092896 , 0.30000001192092896
"El video lo dice todo, escuchen quién tiene contacto con los que bloquearon la vía en Tucurinca, Zona Bananera. ", 0.0 , 0.0
#SOSMagdalena @FiscaliaCol @NoticiasRCN @PGN_COL @lafm ,,
Hermosa manifestación pacífica para la inclusión de sectores que contribuyen al desarrollo de la nación. , 0.5 , 0.5
⁦@FiscaliaCol⁩ ⁦@PoliciaColombia⁩ ,,
Los mamertos descarados de esta fundación borraron los resultados de la encuesta. , -0.20000000298023224 , 0.20000000298023224
#AsiSon ,,
"Que responda ése tal comité pro terrorista que deja a enfermos de COVID sin oxígeno; a madres en parto ver morir a su neonato; al pueblo sin comida, para que haya HAMBRE por desabastecimiento; que no haya gasolina y todo sea más caro. ", -0.20000000298023224 , 0.20000000298023224
¡Que se quiebren todos! , 0.4000000059604645 , 0.4000000059604645
¡Qué horror! , -0.6000000238418579 , 0.6000000238418579
El gobernador necesita un siquiatra. , 0.0 , 0.0
"Bueno, eso le sucede a todo izquierdópata: pierde la noción de la realidad. ", -0.30000001192092896 , 0.30000001192092896
La democracia NO existe. , -0.699999988079071 , 0.699999988079071
Sólo el terrorismo con disfraz humanitario. , 0.10000000149011612 , 0.10000000149011612
"#Atento | El porcentaje de empresas operando a plena capacidad pasó de 30% en marzo a 8% en abril, según la Cámara de Comercio de Bogotá. ", 0.10000000149011612 , 0.10000000149011612
"Pido a @FiscaliaCol, @PGN_COL, @PoliciaColombia, investigar las denuncias del gobernador de Magdalena, exigirle que aporte las pruebas y se sancione a responsables. ", 0.30000001192092896 , 0.30000001192092896
El departamento ha visto quiénes han convocado las marchas. , 0.30000001192092896 , 0.30000001192092896
Son los mismos que pretenden enlodar al @CeDemocratico ,,
“Los están matando y ellos también tienen derecho a la vida”: Esposa de policía entregó desgarrador testimonio - Konuco ,,
A los civiles se les deben respetar los derechos humanos y a los policías y militares también.... , -0.20000000298023224 , 0.20000000298023224
en la fuerza pública hay seres humanos no cosas... , 0.20000000298023224 , 0.20000000298023224
miren esto👇👇👇👇👇,,
Paro nacional Medellín: queman estación de Metroplús - Medellín - Colombia -  ,,
"A Kevin Mendoza, venezolano desagradecido con Colombia se trajo sus malas costumbres chavistas, metido en las marchas y los violentos también le vandalizaron el chuzo  @pasionpais @Gilbert_Olarte @cecollm @Claraaguilar11 @ibmtw2010 @Iadossa @alfredohns1 ",,
¡Atentos! , -0.20000000298023224 , 0.20000000298023224
He aquí el pliego del Paro.... , 0.10000000149011612 , 0.10000000149011612
¿Se queda sin país y apoya la misma receta en Colombia? , 0.10000000149011612 , 0.10000000149011612
"#Colombia | La democracia nos necesita y es fundamental que las Universidades, como formadores del conocimiento, apoyen el cambio del discurso incendiario para pasar a las propuestas y el diálogo con respeto a las normas e instituciones. ", 0.4000000059604645 , 0.4000000059604645
Aquí nuestra petición: ,,
"En video: Criminales atacaron a bala un helicóptero de la Policía en Buga, en medio de protestas por el Paro Nacional ",,
"Ni una sola palabra de solidaridad con los 600 policías heridos, 40 hospitalizados, 4 asesinados por el terrorismo urbano financiado e instrumentalizado desde el exterior. ", 0.10000000149011612 , 0.10000000149011612
"La ⁦@ONU_es⁩ desconoce además los derechos a la libre movilización, al trabajo y a una vida en paz. ", 0.20000000298023224 , 0.20000000298023224
Senadora Cabal pide a la ONU que se manifieste frente a agresiones contra la Fuerza Pública en Colombia | Maria Fernanda Cabal ,,
Grotesco! , 0.0 , 0.0
"Los ""pacifistas"" que se llenan la boca hablando de protección a los animales, atropellan sin piedad a los perritos de la calle pq lo único que les interesa es generar caos y acabar con todo. ", 0.0 , 0.0
La vida de ningún ser vivo vale nada para ellos ¡Dios los perdone! , -0.6000000238418579 , 0.6000000238418579
"1/3 Cancillería, en nombre del Gobierno Nacional, informa que se tomó la decisión de declarar persona non grata a un funcionario de la embajada de Cuba acreditado en Colombia",,
Ésto es inadmisible. , 0.0 , 0.0
Todo un concierto para delinquir. , 0.6000000238418579 , 0.6000000238418579
"En eso usan los dineros públicos, para el Paro, aniquilando la reactivación económica e invitando a la gente al contagio y la muerte. ", 0.0 , 0.0
Vamos a denunciar éstos hechos. , -0.4000000059604645 , 0.4000000059604645
@PGN_COL @FiscaliaCol,,
Tardío. , 0.0 , 0.0
Han debido romper relaciones con la isla del mal desde el inicio de éste gobierno. , -0.30000001192092896 , 0.30000001192092896
Terrorismo urbano en su máxima expresión. , 0.4000000059604645 , 0.4000000059604645
#SOSColombiaDDHH #SOSBogota #Colombia #ConmociónInteriorYa #ConmocionInterior ,,
"Teniendo en cuenta los hechos de los últimos días hemos instalado 22 comisiones verificadoras de Derechos Humanos, varias de ellas ya están distribuidas y funcionando en los puntos más críticos de manifestaciones. ", 0.20000000298023224 , 0.20000000298023224
¡Seguiremos protegiendo el derecho a la protesta de los jóvenes! , 0.30000001192092896 , 0.30000001192092896
Así se siente cuando hacen fakes contra uno. , 0.0 , 0.0
Lo lamento. , -0.800000011920929 , 0.800000011920929
"Menos mal lo logró rápido, yo llevo cuatro años esperando que la fiscalía haga algo contra el tipo de la Bogota Humana que inventó que yo felicitaba al asesino de Yuliana Samboni. ", 0.0 , 0.0
"#EnVivo | ""La reforma tributaria la presentaron en un momento inadecuado, fue una torpeza absoluta por parte de este gobierno"" en @RevistaSemana ",,
"Desgarrador: ambulancias que no pueden pasar, pacientes sin oxígeno y vacunación frenada en Bogotá -&gt;  ",,
"Espero de la ONU y demás organizaciones de derechos humanos, un rechazo igual de contundente por la barbarie contra nuestros policías. ", -0.30000001192092896 , 0.30000001192092896
"Los han asesinado, humillado, golpeado indefensos e intentaron quemarlos vivos. ", -0.30000001192092896 , 0.30000001192092896
🚨 #FakeNews 🚨 ,,
Debemos rodear a nuestros Policías. , 0.30000001192092896 , 0.30000001192092896
Ellos son los que están poniendo el pecho en esta batalla entre el orden y el caos. , 0.0 , 0.0
#SOSColombiaDDH #SOSColombiaNosEstanMatando #Colombia #ColombiaEnAlertaRoja #ColombiaResiste ,,
Desde helicópteros disparando a la población. , 0.0 , 0.0
Otra expresión de lo que Uribe llama el derecho a la utilización de armas por parte del ejército y la policía. , 0.10000000149011612 , 0.10000000149011612
"Ministro de Defensa, nos vemos en el debate de moción de censura que presentamos ayer 18 congresistas.Por favor, no falte",,
"De las 87 personas denunciadas como desaparecidas ante la @DefensoriaCol durante los 8 días del paro Nacional, 52 ya están ubicadas. ", 0.0 , 0.0
"Había presos que aparecían en la lista, revela el @DirectorPolicia Nacional de @PoliciaColombia General Jorge Luis Vargas en @LaNocheNTN24 👇🏼 ",,
Los protestantes humanitarios no permiten la vacunación. , 0.0 , 0.0
Noche de horror en Bogotá! , -0.30000001192092896 , 0.30000001192092896
16 CAI atacados. , 0.10000000149011612 , 0.10000000149011612
Quemando vivos a los policías! , 0.5 , 0.5
Eso es intento de asesinato! , -0.20000000298023224 , 0.20000000298023224
Hasta un vándalo casi se quema. , 0.0 , 0.0
De verdad! , 0.800000011920929 , 0.800000011920929
Es una noche de horror! , -0.10000000149011612 , 0.10000000149011612
Los policías son seres humanos! , 0.4000000059604645 , 0.4000000059604645
Queman su CAI y por eso deben salir y quedar en las garras de los delincuentes violentos! , 0.0 , 0.0
Siempre es igual. , 0.0 , 0.0
La propaganda marxista con financiación extraña....y el eco internacional de sus redes perversas. , -0.10000000149011612 , 0.10000000149011612
#Colombia | #LasCosasComoSon ,,
"Los ""pacifistas"" han incendiado 16 CAI en Bogotá. ", 0.20000000298023224 , 0.20000000298023224
"En el barrio la Aurora, en Usme, le prendieron fuego a uno con 10 policías adentro. ", 0.20000000298023224 , 0.20000000298023224
"Aunque lograron salir, hay 5 heridos. ", 0.0 , 0.0
#SOSColombia #SOSColombiaNosEstanMatando ,,
"Prepárense para la ""justicia revolucionaria"" que nos dejó el acuerdo de paz de Santos. ", 0.10000000149011612 , 0.10000000149011612
"""Reforma profunda"" dicen los que carecen de vergüenza. ", 0.0 , 0.0
"Valdría la pena, señor CIFUENTES, manifestar su sentido pésame a la viuda del Capitán Solano. ", 0.4000000059604645 , 0.4000000059604645
¿No le parece? , -0.10000000149011612 , 0.10000000149011612
Gracias a @DiegoASantos @CancinoAbog y @PaolaRiveraR2 por ayudarme a denunciar. , 0.20000000298023224 , 0.20000000298023224
Aquí está la retractación de la Artista @MartinaMusica por favor ayúdenme a difundir tengo graves amenazas y necesito que la gente sepa que no soy yo! , -0.4000000059604645 , 0.4000000059604645
@RevistaSemana @EEopinion ,,
¿Esta falsedad la afirma para que se la lea su red de mamertos internacionales? , 0.0 , 0.0
Qué desgracia. , -0.699999988079071 , 0.699999988079071
"#Entrevista | “Estas hordas de imbecilidad colectiva, no son gratis, tienen un precio, siempre les pagan y ese dinero viene del narcotráfico” en @Horadelaverdad",,
El incoherente discurso progre. , -0.20000000298023224 , 0.20000000298023224
"#AlAire | ""Con el terrorismo no se dialoga, no se negocia; porque ellos buscan el derrocamiento del gobierno de turno"" - en @Horadelaverdad ",,
No lo harán. , -0.10000000149011612 , 0.10000000149011612
Esta en su agenda globalista destructiva. , 0.10000000149011612 , 0.10000000149011612
Está Soros que financia las ong que persigue policías. , 0.0 , 0.0
"#Colombia | “Están en el juego de tumbar a Duque (…) estas marchas están completamente organizadas, instrumentalizan a la gente que cree que va por una justa causa” ",,
#NosEstánCuidando | Hombres y mujeres de nuestra @PoliciaColombia que arriesgan su vida por salvaguardar la seguridad de los colombianos. , 0.0 , 0.0
Son terroristas; no vándalos. , -0.4000000059604645 , 0.4000000059604645
Ya los hechos obligan a modificar la candidez del idioma. , -0.30000001192092896 , 0.30000001192092896
Quiero ver a los derechos humanos? , 0.20000000298023224 , 0.20000000298023224
Pronunciando algo sobre esto 😡 @ONUHumanRights ,,
"Por ello, la JEP hace un llamado para que, con el apoyo de la Organización de las Naciones Unidas (@ONU_es) y de la comunidad internacional, se promueva una reforma profunda de las Fuerzas Armadas del Estado colombiano. ", 0.10000000149011612 , 0.10000000149011612
@ONUHumanRights no dirá nada. , -0.30000001192092896 , 0.30000001192092896
Es cómplice de la destrucción de Colombia. , 0.0 , 0.0
"Pero el policía debe defenderse ""proporcionalmente"". ", 0.0 , 0.0
"O sea, la autoridad no puede tener superioridad material y legal para frenar la barbarie terrorista. ", 0.0 , 0.0
"@Declaracion Cali, Colombia, en estos momentos. ", 0.0 , 0.0
Le están disparando a la fuerza pública personas que participan en las protestas. , 0.30000001192092896 , 0.30000001192092896
Nos atacan simplemente porque trabajamos en RCN. , 0.0 , 0.0
Somos empleados con pensamientos diferentes desde cada una de nuestras islas. , 0.6000000238418579 , 0.6000000238418579
El problema de la generalización. , 0.0 , 0.0
“Queremos trabajar” dice la comunidad caleña en #CorredorHumanitario. , 0.20000000298023224 , 0.20000000298023224
"Ahí tiene, a lo que se enfrenta la ciudadanía y la policía. ", 0.30000001192092896 , 0.30000001192092896
Otra demostración de la protesta pacífica. , 0.30000001192092896 , 0.30000001192092896
Acciones afirmativas de romanticismo revolucionario. , 0.20000000298023224 , 0.20000000298023224
En Cali. , 0.10000000149011612 , 0.10000000149011612
Una notica buena en medio del caos de la izquierda depredadora. , 0.699999988079071 , 0.699999988079071
"Atención Colega de CALI OK que cubría lo ocurrido en Siloé, fue atrac_ado en vivo. ", 0.30000001192092896 , 0.30000001192092896
“Esos policías son unos berracos y me les quito el sombrero”: General Jorge Luis Vargas ,,
JEP hizo un llamado para que se promueva una reforma de las Fuerzas Armadas. , 0.10000000149011612 , 0.10000000149011612
Madre sacó a su hijo de la marcha en Malambo a punta de correazos #noticias #malambo #atlantico ,,
¡Así ES! , 0.4000000059604645 , 0.4000000059604645
@ONUHumanRights @CIDH @HRF_es @verdadcolombia7 @CancilleriaCol,,
Son acciones solidarias... , 0.10000000149011612 , 0.10000000149011612
Se llama libre desarrollo de la animalidad. , 0.20000000298023224 , 0.20000000298023224
#Putumayo al término de Una Marcha pacífica! de Indígenas del Putumayo? , 0.20000000298023224 , 0.20000000298023224
en el parque general Santander! , 0.30000001192092896 , 0.30000001192092896
se lleva a cabo un acto cultural encabezado? , 0.10000000149011612 , 0.10000000149011612
por el Grupo Musical! de #EJERCITO y arrimo de Música llanera! , 0.699999988079071 , 0.699999988079071
Quiero felicitar a éstos dos bailarines? , 0.800000011920929 , 0.800000011920929
#PutumayoTerritoriodePaz ,,
Qué falta hace el valiente Herbin Hoyos. , 0.0 , 0.0
Aquí su revelación de las actuaciones de las milicias urbanas. , 0.699999988079071 , 0.699999988079071
Más vigente que nunca. , 0.699999988079071 , 0.699999988079071
#Atención | Atacan y vandalizan 15 CAI en Bogotá: tensa situación esta noche en la capital. , 0.30000001192092896 , 0.30000001192092896
"En del barrio la Aurora, en Usme, incendiaron uno con 10 policías adentro. ", 0.20000000298023224 , 0.20000000298023224
"Aunque lograron salir, hay uniformados 5 heridos. ", 0.10000000149011612 , 0.10000000149011612
Aquí las imágenes 👇  ,,
Que bárbaros. , 0.30000001192092896 , 0.30000001192092896
Esto sí es la tapa. , 0.5 , 0.5
"""Magistrados"" que vienen del activismo oenegero radical anti fuerza pública, violando el principio de imparcialidad del juez. ", 0.0 , 0.0
Descarados. , 0.30000001192092896 , 0.30000001192092896
Pero es pacífica la protesta... , 0.20000000298023224 , 0.20000000298023224
Curioso que nadie se pregunte quién les paga.... , 0.20000000298023224 , 0.20000000298023224
"Civiles armados disparando contra la Policía en Siloé, comuna 20 de Cali. ", 0.0 , 0.0
"¿Ya se pronunció la ONG ⁦@TembloresOng⁩ que defiende a los ""rompecabezas""? ... ", 0.0 , 0.0
"Aterrador: 15 puñaladas a un policía en Cali, donde se mantienen las protestas ",,
"Colombianos: No seamos inocentes, que nos quede claro que la reforma tributaria solo fue una excusa de la izquierda para implementar su estrategia de desestabilizacion criminal con el objetivo final de la toma del poder. ", 0.0 , 0.0
¡Despertemos! , 0.5 , 0.5
¡No seamos idiotas útiles del comunismo! , -0.10000000149011612 , 0.10000000149011612
¡Y muchos medios diciendo que o protesta es pacífica! , 0.30000001192092896 , 0.30000001192092896
@ONUHumanRights @CIDH @PGN_COL @FiscaliaCol,,
Puro terrorismo urbano. , -0.30000001192092896 , 0.30000001192092896
"Miles de litros de leche tirados a la basura ante la imposibilidad de transportarlos ni para venderlos, ni para regalarlos. ", -0.10000000149011612 , 0.10000000149011612
Y después dicen que los animales y las bestias son las vacas. , 0.10000000149011612 , 0.10000000149011612
"#Atención | Una ambulancia que transportaba una mujer en trabajo de parto prematuro, fue atacada en el municipio de Tocancipá Cundinamarca por varias personas que estaban bloqueando esta vía. ", 0.20000000298023224 , 0.20000000298023224
El bebé falleció dentro del vehículo. , 0.0 , 0.0
Somos más. , 0.20000000298023224 , 0.20000000298023224
"Aterrador: 15 puñaladas a un policía en Cali, donde se mantienen las protestas ",,
Un premio para ella. , 0.20000000298023224 , 0.20000000298023224
This mother's baby died during labour. , -0.699999988079071 , 0.699999988079071
"The ambulance was attacked in Tocancipa, Cundinamarca by protesters blocking the road. ", -0.699999988079071 , 0.699999988079071
"Es increíble como la oposición, desde sus trincheras mediáticas, desfigura la realidad. ", 0.30000001192092896 , 0.30000001192092896
"Militarizar las ciudades es garantizar a comerciantes, trabajadores, transeúntes sus derechos conculcados por el terrorismo urbano que se adueña del malestar ciudadano. ", 0.0 , 0.0
#ConmocionInteriorYA,,
¿Le están pagando a los que marchan? , 0.0 , 0.0
"Aterrador: 15 puñaladas a un policía en Cali, donde se mantienen las protestas ",,
"Hoy, es necesario hacer un minuto de silencio por todos los héroes de Colombia. ", 0.10000000149011612 , 0.10000000149011612
"Por esos policías y militares que día a día salen a defender la democracia, incluso entregando su propia vida para defender la nuestra. ", 0.699999988079071 , 0.699999988079071
La gente buena suplicando por trabajo y estos vándalos antisociales destruyendo y asesinando. , 0.800000011920929 , 0.800000011920929
Ésta es la línea,,
"#Columna | De esta forma, se convirtió en campo fértil el renacimiento de movimientos que mutan en grupos de choque con investidura estudiantil, bajo la figura del “derecho a la protesta social”. ", 0.0 , 0.0
"Así como la extrema izquierda formó un grupo con el nombre ""Comité Nacional de Paro"" y pretenden representar a todo el país y mantener un paro permanente, deberíamos conformar un ""Comité Nacional de Productividad"" y pasar nuestras exigencias. ", 0.0 , 0.0
Acá dejo una propuesta. , 0.30000001192092896 , 0.30000001192092896
Que caiga todo el peso de la ley contra este criminal ,,
